['B', 'C', 'D', 'E', 'F', 'G', 'H']
Set parameter WLSAccessID
Set parameter WLSSecret
Set parameter LicenseID to value 2687964
Academic license 2687964 - for non-commercial use only - registered to sa___@iict.buet.ac.bd
Set parameter TimeLimit to value 120
Set parameter PoolSearchMode to value 2
Set parameter PoolSolutions to value 1
Set parameter PoolGap to value 0
Gurobi Optimizer version 12.0.3 build v12.0.3rc0 (linux64 - "Rocky Linux 9.6 (Blue Onyx)")

CPU model: AMD EPYC 9454 48-Core Processor, instruction set [SSE2|AVX|AVX2|AVX512]
Thread count: 96 physical cores, 96 logical processors, using up to 32 threads

Non-default parameters:
TimeLimit  120
PoolSolutions  1
PoolSearchMode  2
PoolGap  0

Academic license 2687964 - for non-commercial use only - registered to sa___@iict.buet.ac.bd
Optimize a model with 39871 rows, 4320 columns and 116553 nonzeros
Model fingerprint: 0xa3b8c327
Model has 266 quadratic constraints
Variable types: 2933 continuous, 1387 integer (1387 binary)
Coefficient statistics:
  Matrix range     [4e-02, 3e+05]
  QMatrix range    [1e+00, 1e+00]
  QLMatrix range   [2e+01, 2e+01]
  Objective range  [6e+02, 3e+03]
  Bounds range     [1e+00, 1e+00]
  RHS range        [1e+00, 7e+00]
  QRHS range       [2e+01, 2e+01]
Presolve removed 26593 rows and 2367 columns
Presolve time: 0.34s
Presolved: 13456 rows, 2042 columns, 39863 nonzeros
Variable types: 845 continuous, 1197 integer (1197 binary)
Root relaxation presolved: 13148 rows, 2037 columns, 39214 nonzeros


Use crossover to convert LP symmetric solution to basic solution...

Root relaxation: objective 2.033900e+04, 3202 iterations, 0.54 seconds (0.31 work units)

    Nodes    |    Current Node    |     Objective Bounds      |     Work
 Expl Unexpl |  Obj  Depth IntInf | Incumbent    BestBd   Gap | It/Node Time

     0     0 20339.0000    0  228          - 20339.0000      -     -    1s
     0     0 20339.0000    0  206          - 20339.0000      -     -    2s
     0     0 20339.0000    0   92          - 20339.0000      -     -   17s
     0     0 20339.0000    0   85          - 20339.0000      -     -   17s
     0     0 20339.0000    0   70          - 20339.0000      -     -   21s
     0     0 20339.0000    0  167          - 20339.0000      -     -   21s
     0     0 20339.0000    0  138          - 20339.0000      -     -   25s
     0     0 20339.0000    0  123          - 20339.0000      -     -   25s
     0     0 20339.0000    0   84          - 20339.0000      -     -   27s
     0     0 20339.0000    0   74          - 20339.0000      -     -   27s
     0     0 20339.0000    0   66          - 20339.0000      -     -   31s
     0     0 20339.0000    0   75          - 20339.0000      -     -   31s
     0     0 20339.0000    0   40          - 20339.0000      -     -   33s
     0     0 20339.0000    0   39          - 20339.0000      -     -   33s
     0     0 20339.0000    0   37          - 20339.0000      -     -   34s
     0     0 20339.0000    0   37          - 20339.0000      -     -   35s
     0     2 20339.0000    0   23          - 20339.0000      -     -   38s
    15    32 20339.0000    4  137          - 20339.0000      -   423   40s
    95   173 20339.0000    7  177          - 20339.0000      -   678   48s
   175   422 20339.0000    8  142          - 20339.0000      -   520   51s
   442   934 20339.0000    9  110          - 20339.0000      -   457   55s
  2193  1798 20339.0000   11   97          - 20339.0000      -   307   64s
  3020  2415 20339.0000   11   85          - 20339.0000      -   305   69s
  4072  2416 20004.6296   31   37          - 20339.0000      -   302   87s
  4074  2417 18221.2867   28  126          - 20339.0000      -   302   96s
  4075  2418 17403.0000   24  106          - 20339.0000      -   302  111s

Cutting planes:
  Learned: 2
  Gomory: 3
  Lift-and-project: 14
  Cover: 32
  Implied bound: 7
  Projected implied bound: 1
  Clique: 5
  MIR: 28
  Flow cover: 97
  Inf proof: 1
  Zero half: 27
  RLT: 164
  Relax-and-lift: 1
  BQP: 13
  PSD: 2

Explored 4076 nodes (1308944 simplex iterations) in 120.01 seconds (32.48 work units)
Thread count was 32 (of 96 available processors)

Solution count 0

Time limit reached
Best objective -, best bound 2.033900000000e+04, gap -
Number of solutions found: 0
Set parameter WLSAccessID
Set parameter WLSSecret
Set parameter LicenseID to value 2687964
Academic license 2687964 - for non-commercial use only - registered to sa___@iict.buet.ac.bd
Set parameter TimeLimit to value 600
Set parameter PoolSearchMode to value 2
Set parameter PoolSolutions to value 1
Set parameter PoolGap to value 0
Gurobi Optimizer version 12.0.3 build v12.0.3rc0 (linux64 - "Rocky Linux 9.6 (Blue Onyx)")

CPU model: AMD EPYC 9454 48-Core Processor, instruction set [SSE2|AVX|AVX2|AVX512]
Thread count: 96 physical cores, 96 logical processors, using up to 32 threads

Non-default parameters:
TimeLimit  600
PoolSolutions  1
PoolSearchMode  2
PoolGap  0

Academic license 2687964 - for non-commercial use only - registered to sa___@iict.buet.ac.bd
Optimize a model with 39871 rows, 4320 columns and 116553 nonzeros
Model fingerprint: 0xa3b8c327
Model has 266 quadratic constraints
Variable types: 2933 continuous, 1387 integer (1387 binary)
Coefficient statistics:
  Matrix range     [4e-02, 3e+05]
  QMatrix range    [1e+00, 1e+00]
  QLMatrix range   [2e+01, 2e+01]
  Objective range  [6e+02, 3e+03]
  Bounds range     [1e+00, 1e+00]
  RHS range        [1e+00, 7e+00]
  QRHS range       [2e+01, 2e+01]
Presolve removed 26593 rows and 2367 columns
Presolve time: 0.14s
Presolved: 13456 rows, 2042 columns, 39863 nonzeros
Variable types: 845 continuous, 1197 integer (1197 binary)
Root relaxation presolved: 13148 rows, 2037 columns, 39214 nonzeros


Use crossover to convert LP symmetric solution to basic solution...

Root relaxation: objective 2.033900e+04, 3202 iterations, 0.17 seconds (0.31 work units)

    Nodes    |    Current Node    |     Objective Bounds      |     Work
 Expl Unexpl |  Obj  Depth IntInf | Incumbent    BestBd   Gap | It/Node Time

     0     0 20339.0000    0  228          - 20339.0000      -     -    0s
     0     0 20339.0000    0  206          - 20339.0000      -     -    2s
     0     0 20339.0000    0   92          - 20339.0000      -     -   14s
     0     0 20339.0000    0   85          - 20339.0000      -     -   14s
     0     0 20339.0000    0   70          - 20339.0000      -     -   18s
     0     0 20339.0000    0  167          - 20339.0000      -     -   19s
     0     0 20339.0000    0  138          - 20339.0000      -     -   22s
     0     0 20339.0000    0  123          - 20339.0000      -     -   22s
     0     0 20339.0000    0   84          - 20339.0000      -     -   25s
     0     0 20339.0000    0   74          - 20339.0000      -     -   25s
     0     0 20339.0000    0   66          - 20339.0000      -     -   29s
     0     0 20339.0000    0   75          - 20339.0000      -     -   29s
     0     0 20339.0000    0   40          - 20339.0000      -     -   31s
     0     0 20339.0000    0   39          - 20339.0000      -     -   31s
     0     0 20339.0000    0   37          - 20339.0000      -     -   33s
     0     0 20339.0000    0   37          - 20339.0000      -     -   33s
     0     2 20339.0000    0   23          - 20339.0000      -     -   37s
    15    32 20339.0000    4  137          - 20339.0000      -   423   40s
    95   173 20339.0000    7  177          - 20339.0000      -   678   50s
   175   422 20339.0000    8  142          - 20339.0000      -   520   55s
   442   934 20339.0000    9  110          - 20339.0000      -   457   60s
  1279  1368 20265.0497   15  212          - 20339.0000      -   331   66s
  2193  1798 20339.0000   11   97          - 20339.0000      -   307   70s
  4072  2416 20004.6296   31   37          - 20339.0000      -   302   94s
  4074  2417 18221.2867   28  126          - 20339.0000      -   302  104s
  4075  2418 17403.0000   24  106          - 20339.0000      -   302  118s
  4076  2419 17248.0000   19  178          - 20339.0000      -   302  121s
  4077  2419 20339.0000   10  133          - 20339.0000      -   301  129s
  4078  2420 20339.0000   16  129          - 20339.0000      -   301  131s
  4079  2421 20339.0000   15   38          - 20339.0000      -   301  137s
  4081  2422 20339.0000   13   28          - 20339.0000      -   301  140s
  4087  2426 19579.5531   19   40          - 20339.0000      -   301  145s
  4091  2429 20339.0000   11   23          - 20339.0000      -   300  150s
  4094  2431 20339.0000   10  110          - 20339.0000      -   300  161s
  4096  2435 20339.0000   13   77          - 20339.0000      -   314  166s
  4110  2458 20339.0000   16   77          - 20339.0000      -   314  170s
  4190  2614 20101.0000   19  109          - 20339.0000      -   319  175s
  4548  2723 19625.0000   26   48          - 20339.0000      -   314  182s
  4795  2793 19624.8127   29  154          - 20339.0000      -   312  186s
  4963  2770 infeasible   30               - 20339.0000      -   311  193s
  5096  2782 infeasible   33               - 20339.0000      -   312  195s
  5651  2740 16452.0000   40   65          - 20339.0000      -   310  201s
  6392  2703 infeasible   33               - 20339.0000      -   306  206s
  7021  2609 infeasible   24               - 20339.0000      -   305  215s
  8048  2657 20288.3939   34   63          - 20339.0000      -   301  221s
  8751  2493 infeasible   39               - 20339.0000      -   293  225s
  9848  2341 20313.6970   36   91          - 20339.0000      -   284  231s
 10574  2170 20338.5502   23  167          - 20339.0000      -   281  236s
 10986  2083 19625.0000   27   64          - 20339.0000      -   279  249s
 11192  2116 infeasible   32               - 20339.0000      -   278  252s
 11654  2082 16999.0000   28   43          - 20339.0000      -   277  255s
 12448  2230 infeasible   28               - 20339.0000      -   275  260s
 13346  2382 infeasible   28               - 20339.0000      -   273  266s
 14105  2619 19459.0000   26   39          - 20339.0000      -   276  273s
 14548  2712 17166.0000   33   73          - 20339.0000      -   277  275s
 15322  2855 16986.2344   36   62          - 20339.0000      -   279  282s
 15755  3017 20338.9990   28   61          - 20339.0000      -   281  286s
 16710  3203 infeasible   31               - 20339.0000      -   284  292s
 17133  3336 18268.4688   25   82          - 20339.0000      -   286  296s
 17619  3396 16999.0000   34   56          - 20339.0000      -   288  300s
 18028  3421 20339.0000   30   58          - 20339.0000      -   289  320s
 18254  3566 20339.0000   32   24          - 20339.0000      -   292  325s
 18726  3629 19459.0000   31   56          - 20339.0000      -   295  330s
 19819  3864 20339.0000   34   52          - 20339.0000      -   299  339s
 20434  4014 19938.7738   42  122          - 20339.0000      -   301  343s
 21183  4155 19691.2222   36   95          - 20339.0000      -   301  348s
 21772  4309 18734.0000   41   46          - 20339.0000      -   302  354s
 22540  4510 infeasible   38               - 20339.0000      -   302  361s
 23588  4681 infeasible   35               - 20339.0000      -   301  366s
 24471  4944 19625.0000   35   64          - 20339.0000      -   301  372s
 25461  5128 infeasible   31               - 20339.0000      -   300  378s
 26268  5393 19783.9795   29  125          - 20339.0000      -   301  384s
 27314  5631 19042.1681   35   62          - 20339.0000      -   302  390s
 28170  5756 19070.0000   35   74          - 20339.0000      -   304  396s
 29120  6007 12557.0000   38   91          - 20339.0000      -   305  408s
 30396  6197 17723.6267   25  139          - 20339.0000      -   305  416s
 31342  6540 17166.0000   36   59          - 20339.0000      -   306  425s
 32635  6623 20339.0000   33   28          - 20339.0000      -   306  439s
 33008  6931 19458.9880   36   59          - 20339.0000      -   307  447s
 34383  7385 18020.0000   30   70          - 20339.0000      -   306  455s
 36415  7797 17166.0000   35   69          - 20339.0000      -   303  463s
 38251  8031 20339.0000   44   48          - 20339.0000      -   300  470s
 39836  8407 19777.9005   50  105          - 20339.0000      -   298  479s
 41751  8703 infeasible   32               - 20339.0000      -   295  488s
 43290  9070 20337.7002   38   43          - 20339.0000      -   294  496s
 45139  9370 infeasible   43               - 20339.0000      -   293  506s
 46565  9770 20338.6068   30   96          - 20339.0000      -   294  516s
 48312 10166 infeasible   38               - 20339.0000      -   293  525s
 50184 10550 20338.9055   36  112          - 20339.0000      -   293  536s
 51809 10963 infeasible   44               - 20339.0000      -   293  547s
 53599 11260 infeasible   37               - 20339.0000      -   294  560s
 55217 11869 infeasible   36               - 20339.0000      -   295  574s
 57477 12219 infeasible   39               - 20339.0000      -   295  587s

Cutting planes:
  Learned: 1
  Gomory: 1
  Lift-and-project: 1
  Cover: 10
  Implied bound: 6
  MIR: 4
  Flow cover: 20
  Inf proof: 216
  Zero half: 4
  RLT: 19
  Relax-and-lift: 5
  BQP: 5

Explored 59217 nodes (17635488 simplex iterations) in 600.16 seconds (157.60 work units)
Thread count was 32 (of 96 available processors)

Solution count 0

Time limit reached
Best objective -, best bound 2.033900000000e+04, gap -
Number of solutions found: 0
CLONES: 20 , SOLUTION COUNT: 0
Set parameter WLSAccessID
Set parameter WLSSecret
Set parameter LicenseID to value 2687964
Academic license 2687964 - for non-commercial use only - registered to sa___@iict.buet.ac.bd
Set parameter TimeLimit to value 120
Set parameter PoolSearchMode to value 2
Set parameter PoolSolutions to value 1
Set parameter PoolGap to value 0
Gurobi Optimizer version 12.0.3 build v12.0.3rc0 (linux64 - "Rocky Linux 9.6 (Blue Onyx)")

CPU model: AMD EPYC 9454 48-Core Processor, instruction set [SSE2|AVX|AVX2|AVX512]
Thread count: 96 physical cores, 96 logical processors, using up to 32 threads

Non-default parameters:
TimeLimit  120
PoolSolutions  1
PoolSearchMode  2
PoolGap  0

Academic license 2687964 - for non-commercial use only - registered to sa___@iict.buet.ac.bd
Optimize a model with 38426 rows, 4161 columns and 112309 nonzeros
Model fingerprint: 0x483b471b
Model has 266 quadratic constraints
Variable types: 2793 continuous, 1368 integer (1368 binary)
Coefficient statistics:
  Matrix range     [4e-02, 3e+05]
  QMatrix range    [1e+00, 1e+00]
  QLMatrix range   [2e+01, 2e+01]
  Objective range  [6e+02, 3e+03]
  Bounds range     [1e+00, 1e+00]
  RHS range        [1e+00, 7e+00]
  QRHS range       [2e+01, 2e+01]
Presolve removed 25783 rows and 2264 columns
Presolve time: 1.20s
Presolved: 12831 rows, 1991 columns, 37987 nonzeros
Variable types: 803 continuous, 1188 integer (1188 binary)
Root relaxation presolved: 12518 rows, 1981 columns, 37328 nonzeros


Use crossover to convert LP symmetric solution to basic solution...

Root relaxation: objective 2.033900e+04, 2628 iterations, 1.00 seconds (0.22 work units)

    Nodes    |    Current Node    |     Objective Bounds      |     Work
 Expl Unexpl |  Obj  Depth IntInf | Incumbent    BestBd   Gap | It/Node Time

     0     0 20339.0000    0  105          - 20339.0000      -     -    3s
     0     0 20339.0000    0  149          - 20339.0000      -     -    5s
     0     0 20339.0000    0  131          - 20339.0000      -     -    6s
     0     0 20339.0000    0   85          - 20339.0000      -     -   10s
     0     0 20339.0000    0   94          - 20339.0000      -     -   11s
     0     0 20339.0000    0  104          - 20339.0000      -     -   17s
     0     0 20339.0000    0  149          - 20339.0000      -     -   18s
     0     0 20339.0000    0  137          - 20339.0000      -     -   25s
     0     0 20339.0000    0  181          - 20339.0000      -     -   26s
     0     0 20339.0000    0  125          - 20339.0000      -     -   29s
     0     0 20339.0000    0  100          - 20339.0000      -     -   29s
     0     0 20339.0000    0  113          - 20339.0000      -     -   31s
     0     0 20339.0000    0   79          - 20339.0000      -     -   34s
     0     2 20339.0000    0   32          - 20339.0000      -     -   40s
    63    96 20339.0000    6  117          - 20339.0000      -   858   46s
   374   670 20339.0000   15  106          - 20339.0000      -   450   50s
  1953  1493 20135.1501   33  105          - 20339.0000      -   236   57s
  2709  1785 20086.4382   22  107          - 20339.0000      -   232   60s
  4325  2442 20338.2297   14  174          - 20339.0000      -   227   66s
  5245  2443 17166.0000   20   79          - 20339.0000      -   222   83s
  5247  2444 19784.0000   16  214          - 20339.0000      -   221   90s
  5248  2445 20121.9481   28   61          - 20339.0000      -   221   97s
  5250  2446 19760.7781   19  134          - 20339.0000      -   221  105s
  5252  2448 19852.9427   21   80          - 20339.0000      -   221  112s
  5254  2449 12980.0000   21  112          - 20339.0000      -   221  116s

Cutting planes:
  Learned: 2
  Gomory: 2
  Cover: 16
  Implied bound: 6
  Clique: 4
  MIR: 13
  Flow cover: 29
  Inf proof: 1
  Zero half: 11
  RLT: 23
  BQP: 3
  PSD: 1

Explored 5255 nodes (1238556 simplex iterations) in 120.07 seconds (26.41 work units)
Thread count was 32 (of 96 available processors)

Solution count 0

Time limit reached
Best objective -, best bound 2.033900000000e+04, gap -
Number of solutions found: 0
Set parameter WLSAccessID
Set parameter WLSSecret
Set parameter LicenseID to value 2687964
Academic license 2687964 - for non-commercial use only - registered to sa___@iict.buet.ac.bd
Set parameter TimeLimit to value 600
Set parameter PoolSearchMode to value 2
Set parameter PoolSolutions to value 1
Set parameter PoolGap to value 0
Gurobi Optimizer version 12.0.3 build v12.0.3rc0 (linux64 - "Rocky Linux 9.6 (Blue Onyx)")

CPU model: AMD EPYC 9454 48-Core Processor, instruction set [SSE2|AVX|AVX2|AVX512]
Thread count: 96 physical cores, 96 logical processors, using up to 32 threads

Non-default parameters:
TimeLimit  600
PoolSolutions  1
PoolSearchMode  2
PoolGap  0

Academic license 2687964 - for non-commercial use only - registered to sa___@iict.buet.ac.bd
Optimize a model with 38426 rows, 4161 columns and 112309 nonzeros
Model fingerprint: 0x483b471b
Model has 266 quadratic constraints
Variable types: 2793 continuous, 1368 integer (1368 binary)
Coefficient statistics:
  Matrix range     [4e-02, 3e+05]
  QMatrix range    [1e+00, 1e+00]
  QLMatrix range   [2e+01, 2e+01]
  Objective range  [6e+02, 3e+03]
  Bounds range     [1e+00, 1e+00]
  RHS range        [1e+00, 7e+00]
  QRHS range       [2e+01, 2e+01]
Presolve removed 25783 rows and 2264 columns
Presolve time: 1.11s
Presolved: 12831 rows, 1991 columns, 37987 nonzeros
Variable types: 803 continuous, 1188 integer (1188 binary)
Root relaxation presolved: 12518 rows, 1981 columns, 37328 nonzeros


Use crossover to convert LP symmetric solution to basic solution...

Root relaxation: objective 2.033900e+04, 2628 iterations, 0.90 seconds (0.22 work units)

    Nodes    |    Current Node    |     Objective Bounds      |     Work
 Expl Unexpl |  Obj  Depth IntInf | Incumbent    BestBd   Gap | It/Node Time

     0     0 20339.0000    0  105          - 20339.0000      -     -    3s
     0     0 20339.0000    0  149          - 20339.0000      -     -    6s
     0     0 20339.0000    0  131          - 20339.0000      -     -    6s
     0     0 20339.0000    0   85          - 20339.0000      -     -   13s
     0     0 20339.0000    0   94          - 20339.0000      -     -   15s
     0     0 20339.0000    0  104          - 20339.0000      -     -   22s
     0     0 20339.0000    0  149          - 20339.0000      -     -   23s
     0     0 20339.0000    0  137          - 20339.0000      -     -   34s
     0     0 20339.0000    0  181          - 20339.0000      -     -   35s
     0     0 20339.0000    0  125          - 20339.0000      -     -   38s
     0     0 20339.0000    0  100          - 20339.0000      -     -   38s
     0     0 20339.0000    0  113          - 20339.0000      -     -   41s
     0     0 20339.0000    0   79          - 20339.0000      -     -   45s
     0     2 20339.0000    0   32          - 20339.0000      -     -   48s
    15    32 20339.0000    4  114          - 20339.0000      -   490   50s
    95   181 20339.0000    7  128          - 20339.0000      -   899   56s
   708  1193 20200.2500   19   86          - 20339.0000      -   377   62s
  1953  1493 20135.1501   33  105          - 20339.0000      -   236   65s
  3486  2086 18222.5786   20  166          - 20339.0000      -   229   71s
  4325  2442 20338.2297   14  174          - 20339.0000      -   227   75s
  5245  2443 17166.0000   20   79          - 20339.0000      -   222   92s
  5247  2444 19784.0000   16  214          - 20339.0000      -   221   98s
  5248  2445 20121.9481   28   61          - 20339.0000      -   221  104s
  5249  2446 20336.0909   23  103          - 20339.0000      -   221  106s
  5250  2446 19760.7781   19  134          - 20339.0000      -   221  112s
  5252  2448 19852.9427   21   80          - 20339.0000      -   221  117s
  5254  2449 12980.0000   21  112          - 20339.0000      -   221  121s
  5256  2450 16452.0000   34   38          - 20339.0000      -   221  126s
  5260  2453 14661.0000   22   89          - 20339.0000      -   221  132s
  5263  2455 16452.0000   15   83          - 20339.0000      -   221  135s
  5264  2456 20339.0000   19   97          - 20339.0000      -   221  142s
  5267  2458 20339.0000   11   57          - 20339.0000      -   221  151s
  5271  2465 20339.0000   13   44          - 20339.0000      -   230  155s
  5299  2507 20339.0000   16  114          - 20339.0000      -   231  160s
  5619  2706 20339.0000   22   50          - 20339.0000      -   238  167s
  5926  2717 infeasible   26               - 20339.0000      -   238  172s
  6307  2723 19102.0000   28   93          - 20339.0000      -   236  176s
  7537  2563 17795.7405   33  137          - 20339.0000      -   220  180s
  8728  2276 17166.0000   29   73          - 20339.0000      -   209  191s
  9822  2099 infeasible   32               - 20339.0000      -   199  195s
 11104  1834 17166.0000   31   61          - 20339.0000      -   197  201s
 11995  1657 17166.0000   32   39          - 20339.0000      -   197  205s
 12779  1642 infeasible   33               - 20339.0000      -   201  211s
 13502  1827 20339.0000   29   57          - 20339.0000      -   207  216s
 14123  1900 20339.0000   33   67          - 20339.0000      -   211  221s
 14322  1966 20335.8652   35   81          - 20339.0000      -   213  235s
 14786  2131 16182.0000   30   28          - 20339.0000      -   217  240s
 15612  2326 infeasible   45               - 20339.0000      -   218  245s
 16768  2558 20339.0000   33   22          - 20339.0000      -   216  250s
 18244  2664 infeasible   29               - 20339.0000      -   211  255s
 19442  2865 20292.5704   30   95          - 20339.0000      -   211  261s
 20718  3075 infeasible   23               - 20339.0000      -   210  267s
 21333  3251 18236.9759   41   59          - 20339.0000      -   211  270s
 22956  3352 16349.0000   46   42          - 20339.0000      -   209  276s
 23518  3459 infeasible   45               - 20339.0000      -   210  280s
 24919  3611 17166.0000   33   45          - 20339.0000      -   212  296s
 25741  3859 15777.0000   30   58          - 20339.0000      -   216  303s
 26328  4037 20339.0000   25  106          - 20339.0000      -   219  308s
 26993  4107 infeasible   36               - 20339.0000      -   221  312s
 27383  4345 20339.0000   25  105          - 20339.0000      -   224  316s
 28315  4441 17925.0000   28   74          - 20339.0000      -   225  321s
 28997  4622 infeasible   31               - 20339.0000      -   228  327s
 29853  4751 infeasible   27               - 20339.0000      -   230  333s
 30602  5030 infeasible   29               - 20339.0000      -   235  339s
 31846  5352 20339.0000   22   59          - 20339.0000      -   238  345s
 33021  5541 18957.3939   25   72          - 20339.0000      -   241  352s
 34072  5813 20339.0000   26  114          - 20339.0000      -   245  360s
 35428  5845 infeasible   38               - 20339.0000      -   247  379s
 35787  6082 infeasible   32               - 20339.0000      -   248  387s
 37069  6458 infeasible   31               - 20339.0000      -   252  395s
 38442  6716 17166.0000   32   80          - 20339.0000      -   255  404s
 39677  6896 infeasible   31               - 20339.0000      -   260  413s
 40960  7125 17166.0000   34   53          - 20339.0000      -   264  423s
 42417  7388 20339.0000   24  127          - 20339.0000      -   268  434s
 43801  7752 20325.0616   30  202          - 20339.0000      -   272  444s
 45370  8145 infeasible   38               - 20339.0000      -   276  455s
 47166  8528 infeasible   37               - 20339.0000      -   278  467s
 49169  9116 infeasible   35               - 20339.0000      -   280  478s
 52378  9601 infeasible   39               - 20339.0000      -   275  489s
 55625 10033 20339.0000   29   77          - 20339.0000      -   270  500s

Cutting planes:
  Learned: 2
  Gomory: 3
  Cover: 13
  Implied bound: 10
  Clique: 1
  MIR: 1
  Flow cover: 11
  Inf proof: 100
  Zero half: 7
  RLT: 25
  Relax-and-lift: 10
  BQP: 2
  PSD: 1

Explored 58302 nodes (15667327 simplex iterations) in 600.30 seconds (140.39 work units)
Thread count was 32 (of 96 available processors)

Solution count 0

Time limit reached
Best objective -, best bound 2.033900000000e+04, gap -
Number of solutions found: 0
CLONES: 19 , SOLUTION COUNT: 0
Set parameter WLSAccessID
Set parameter WLSSecret
Set parameter LicenseID to value 2687964
Academic license 2687964 - for non-commercial use only - registered to sa___@iict.buet.ac.bd
Set parameter TimeLimit to value 120
Set parameter PoolSearchMode to value 2
Set parameter PoolSolutions to value 1
Set parameter PoolGap to value 0
Gurobi Optimizer version 12.0.3 build v12.0.3rc0 (linux64 - "Rocky Linux 9.6 (Blue Onyx)")

CPU model: AMD EPYC 9454 48-Core Processor, instruction set [SSE2|AVX|AVX2|AVX512]
Thread count: 96 physical cores, 96 logical processors, using up to 32 threads

Non-default parameters:
TimeLimit  120
PoolSolutions  1
PoolSearchMode  2
PoolGap  0

Academic license 2687964 - for non-commercial use only - registered to sa___@iict.buet.ac.bd
Optimize a model with 36981 rows, 4002 columns and 108065 nonzeros
Model fingerprint: 0x6fbe0995
Model has 266 quadratic constraints
Variable types: 2653 continuous, 1349 integer (1349 binary)
Coefficient statistics:
  Matrix range     [4e-02, 3e+05]
  QMatrix range    [1e+00, 1e+00]
  QLMatrix range   [2e+01, 2e+01]
  Objective range  [6e+02, 3e+03]
  Bounds range     [1e+00, 1e+00]
  RHS range        [1e+00, 7e+00]
  QRHS range       [2e+01, 2e+01]
Presolve removed 24951 rows and 2161 columns
Presolve time: 1.11s
Presolved: 12208 rows, 1930 columns, 36107 nonzeros
Variable types: 761 continuous, 1169 integer (1169 binary)
Root relaxation presolved: 11900 rows, 1925 columns, 35458 nonzeros


Use crossover to convert LP symmetric solution to basic solution...

Root relaxation: objective 2.033900e+04, 2630 iterations, 0.96 seconds (0.22 work units)

    Nodes    |    Current Node    |     Objective Bounds      |     Work
 Expl Unexpl |  Obj  Depth IntInf | Incumbent    BestBd   Gap | It/Node Time

     0     0 20339.0000    0   59          - 20339.0000      -     -    4s
     0     0 20339.0000    0  218          - 20339.0000      -     -    7s
     0     0 20339.0000    0  205          - 20339.0000      -     -    8s
     0     0 20339.0000    0  170          - 20339.0000      -     -   12s
     0     0 20339.0000    0  113          - 20339.0000      -     -   12s
     0     0 20339.0000    0   89          - 20339.0000      -     -   13s
     0     0 20339.0000    0  121          - 20339.0000      -     -   13s
     0     0 20339.0000    0  148          - 20339.0000      -     -   15s
     0     0 20339.0000    0  142          - 20339.0000      -     -   15s
     0     0 20339.0000    0  138          - 20339.0000      -     -   17s
     0     0 20339.0000    0   95          - 20339.0000      -     -   19s
     0     2 20339.0000    0   30          - 20339.0000      -     -   25s
    92   192 20339.0000    7  150          - 20339.0000      -   621   30s
  1234  1292 20339.0000   23   93          - 20339.0000      -   238   36s
  3237  1908 18826.5025   26   41          - 20339.0000      -   187   40s
  5850  2477 20326.8398   20   95          - 20339.0000      -   171   59s
  5852  2478 19784.0000   26  170          - 20339.0000      -   171   67s
  5853  2479 15857.0000   24   74          - 20339.0000      -   171   75s
  5855  2480 17166.0000   21  102          - 20339.0000      -   171   82s
  5857  2482 20339.0000   11   83          - 20339.0000      -   171   88s
  5859  2483 19784.0000   28   68          - 20339.0000      -   171   92s
  5862  2485 20302.3885   26   30          - 20339.0000      -   171   95s
  5869  2490 16999.0000   30   18          - 20339.0000      -   171  100s
  5872  2492 16182.0085   30    9          - 20339.0000      -   171  108s
  5874  2496 20339.0000   12   31          - 20339.0000      -   177  110s
  5968  2647 20339.0000   18  102          - 20339.0000      -   180  115s
  6068  2708 20339.0000   20   59          - 20339.0000      -   181  120s

Cutting planes:
  Learned: 2
  Gomory: 2
  Lift-and-project: 3
  Cover: 17
  Implied bound: 3
  Clique: 2
  MIR: 11
  Flow cover: 25
  Zero half: 15
  RLT: 24
  Relax-and-lift: 11
  BQP: 12

Explored 6185 nodes (1170998 simplex iterations) in 120.03 seconds (27.58 work units)
Thread count was 32 (of 96 available processors)

Solution count 0

Time limit reached
Best objective -, best bound 2.033900000000e+04, gap -
Number of solutions found: 0
Set parameter WLSAccessID
Set parameter WLSSecret
Set parameter LicenseID to value 2687964
Academic license 2687964 - for non-commercial use only - registered to sa___@iict.buet.ac.bd
Set parameter TimeLimit to value 600
Set parameter PoolSearchMode to value 2
Set parameter PoolSolutions to value 1
Set parameter PoolGap to value 0
Gurobi Optimizer version 12.0.3 build v12.0.3rc0 (linux64 - "Rocky Linux 9.6 (Blue Onyx)")

CPU model: AMD EPYC 9454 48-Core Processor, instruction set [SSE2|AVX|AVX2|AVX512]
Thread count: 96 physical cores, 96 logical processors, using up to 32 threads

Non-default parameters:
TimeLimit  600
PoolSolutions  1
PoolSearchMode  2
PoolGap  0

Academic license 2687964 - for non-commercial use only - registered to sa___@iict.buet.ac.bd
Optimize a model with 36981 rows, 4002 columns and 108065 nonzeros
Model fingerprint: 0x6fbe0995
Model has 266 quadratic constraints
Variable types: 2653 continuous, 1349 integer (1349 binary)
Coefficient statistics:
  Matrix range     [4e-02, 3e+05]
  QMatrix range    [1e+00, 1e+00]
  QLMatrix range   [2e+01, 2e+01]
  Objective range  [6e+02, 3e+03]
  Bounds range     [1e+00, 1e+00]
  RHS range        [1e+00, 7e+00]
  QRHS range       [2e+01, 2e+01]
Presolve removed 24951 rows and 2161 columns
Presolve time: 1.18s
Presolved: 12208 rows, 1930 columns, 36107 nonzeros
Variable types: 761 continuous, 1169 integer (1169 binary)
Root relaxation presolved: 11900 rows, 1925 columns, 35458 nonzeros


Use crossover to convert LP symmetric solution to basic solution...

Root relaxation: objective 2.033900e+04, 2630 iterations, 0.98 seconds (0.22 work units)
Total elapsed time = 5.04s (DegenMoves)

    Nodes    |    Current Node    |     Objective Bounds      |     Work
 Expl Unexpl |  Obj  Depth IntInf | Incumbent    BestBd   Gap | It/Node Time

     0     0 20339.0000    0   59          - 20339.0000      -     -    5s
     0     0 20339.0000    0  218          - 20339.0000      -     -    8s
     0     0 20339.0000    0  205          - 20339.0000      -     -    9s
     0     0 20339.0000    0  170          - 20339.0000      -     -   13s
     0     0 20339.0000    0  113          - 20339.0000      -     -   14s
     0     0 20339.0000    0   89          - 20339.0000      -     -   15s
     0     0 20339.0000    0  121          - 20339.0000      -     -   16s
     0     0 20339.0000    0  148          - 20339.0000      -     -   18s
     0     0 20339.0000    0  142          - 20339.0000      -     -   18s
     0     0 20339.0000    0  138          - 20339.0000      -     -   21s
     0     0 20339.0000    0   95          - 20339.0000      -     -   23s
     0     2 20339.0000    0   30          - 20339.0000      -     -   29s
     1     4 20339.0000    1   25          - 20339.0000      -  2649   30s
   204   363 20339.0000    8  148          - 20339.0000      -   422   35s
  1234  1292 20339.0000   23   93          - 20339.0000      -   238   40s
  4104  2200 20296.7898   29  259          - 20339.0000      -   181   46s
  5850  2477 20326.8398   20   95          - 20339.0000      -   171   63s
  5852  2478 19784.0000   26  170          - 20339.0000      -   171   70s
  5853  2479 15857.0000   24   74          - 20339.0000      -   171   79s
  5854  2480 19625.0000   23  134          - 20339.0000      -   171   80s
  5855  2480 17166.0000   21  102          - 20339.0000      -   171   87s
  5857  2482 20339.0000   11   83          - 20339.0000      -   171   93s
  5859  2483 19784.0000   28   68          - 20339.0000      -   171   96s
  5861  2484 20339.0000   25   13          - 20339.0000      -   171  100s
  5869  2490 16999.0000   30   18          - 20339.0000      -   171  106s
  5872  2492 16182.0085   30    9          - 20339.0000      -   171  114s
  5873  2492 20339.0000   14    9          - 20339.0000      -   171  115s
  5968  2647 20339.0000   18  102          - 20339.0000      -   180  120s
  6068  2708 20339.0000   20   59          - 20339.0000      -   181  125s
  6720  3029 20339.0000   27   39          - 20339.0000      -   191  133s
  7164  3013 16952.1256   33   44          - 20339.0000      -   195  143s
  7521  3046 20288.3939   22   51          - 20339.0000      -   197  146s
  8093  3113 20027.9459   26   64          - 20339.0000      -   196  150s
  9561  3017 infeasible   24               - 20339.0000      -   200  159s
 10101  3052 infeasible   22               - 20339.0000      -   205  161s
 10666  3079 20339.0000   22   49          - 20339.0000      -   206  165s
 12071  3047 19392.6395   22  148          - 20339.0000      -   210  172s
 12725  3023 20339.0000   26   31          - 20339.0000      -   212  176s
 13163  3060 20339.0000   30   28          - 20339.0000      -   215  180s
 14402  3419 11918.5745   38   58          - 20339.0000      -   221  192s
 14914  3702 infeasible   29               - 20339.0000      -   222  196s
 16440  4146 19625.0000   34   47          - 20339.0000      -   223  205s
 18066  4611 20339.0000   21   43          - 20339.0000      -   223  212s
 18731  4839 infeasible   31               - 20339.0000      -   225  216s
 20278  5289 18677.8763   27  102          - 20339.0000      -   227  225s
 21934  5919 20338.9944   33   33          - 20339.0000      -   227  233s
 22872  6207 20339.0000   19   89          - 20339.0000      -   227  239s
 23767  6341 20203.9118   25  102          - 20339.0000      -   227  255s
 23986  6538 infeasible   28               - 20339.0000      -   228  261s
 24765  6766 17666.5313   30   68          - 20339.0000      -   230  265s
 25663  7093 19007.4000   24  135          - 20339.0000      -   230  270s
 26633  7369 18308.3536   23   87          - 20339.0000      -   230  275s
 27662  7708 19504.0000   28   37          - 20339.0000      -   231  280s
 28773  7862 19625.0000   29   23          - 20339.0000      -   231  286s
 29648  8175 infeasible   34               - 20339.0000      -   231  300s
 30722  8521 infeasible   28               - 20339.0000      -   233  306s
 31936  8900 19625.0000   41   22          - 20339.0000      -   234  312s
 33172  9302 infeasible   26               - 20339.0000      -   234  318s
 34478  9722 16999.0000   29   41          - 20339.0000      -   233  324s
 35902 10208 19665.7812   29   96          - 20339.0000      -   233  330s
 37403 10576 infeasible   31               - 20339.0000      -   232  338s
 38662 11026 infeasible   28               - 20339.0000      -   232  344s
 40204 11374 19625.0000   26   41          - 20339.0000      -   231  350s
 41728 11860 20339.0000   22   36          - 20339.0000      -   231  357s
 43278 12366 18745.0000   32   46          - 20339.0000      -   231  364s
 44896 12908 17166.0000   32   35          - 20339.0000      -   230  371s
 46626 13329 16999.0000   30   50          - 20339.0000      -   229  379s
 48212 13855 infeasible   34               - 20339.0000      -   230  386s
 49935 13962 19624.8115   31  108          - 20339.0000      -   230  411s
 50406 14650 infeasible   32               - 20339.0000      -   230  421s
 52705 15171 17925.0000   26   62          - 20339.0000      -   229  430s
 54662 15819 20339.0000   25   80          - 20339.0000      -   229  438s
 56996 16316 infeasible   32               - 20339.0000      -   228  447s
 59173 17056 19459.0000   25   81          - 20339.0000      -   228  589s
 62401 17314 20339.0000   20  169          - 20339.0000      -   226  597s
 63838 17443 infeasible   21               - 20339.0000      -   227  600s

Cutting planes:
  Learned: 2
  Gomory: 8
  Lift-and-project: 5
  Cover: 48
  Implied bound: 8
  Clique: 6
  MIR: 108
  Mixing: 1
  StrongCG: 5
  Flow cover: 184
  Inf proof: 36
  Zero half: 135
  Network: 2
  RLT: 44
  Relax-and-lift: 12
  BQP: 13

Explored 64417 nodes (14666623 simplex iterations) in 600.09 seconds (142.32 work units)
Thread count was 32 (of 96 available processors)

Solution count 0

Time limit reached
Best objective -, best bound 2.033900000000e+04, gap -
Number of solutions found: 0
CLONES: 18 , SOLUTION COUNT: 0
Set parameter WLSAccessID
Set parameter WLSSecret
Set parameter LicenseID to value 2687964
Academic license 2687964 - for non-commercial use only - registered to sa___@iict.buet.ac.bd
Set parameter TimeLimit to value 120
Set parameter PoolSearchMode to value 2
Set parameter PoolSolutions to value 1
Set parameter PoolGap to value 0
Gurobi Optimizer version 12.0.3 build v12.0.3rc0 (linux64 - "Rocky Linux 9.6 (Blue Onyx)")

CPU model: AMD EPYC 9454 48-Core Processor, instruction set [SSE2|AVX|AVX2|AVX512]
Thread count: 96 physical cores, 96 logical processors, using up to 32 threads

Non-default parameters:
TimeLimit  120
PoolSolutions  1
PoolSearchMode  2
PoolGap  0

Academic license 2687964 - for non-commercial use only - registered to sa___@iict.buet.ac.bd
Optimize a model with 35536 rows, 3843 columns and 103821 nonzeros
Model fingerprint: 0x67f89c54
Model has 266 quadratic constraints
Variable types: 2513 continuous, 1330 integer (1330 binary)
Coefficient statistics:
  Matrix range     [4e-02, 3e+05]
  QMatrix range    [1e+00, 1e+00]
  QLMatrix range   [2e+01, 2e+01]
  Objective range  [6e+02, 3e+03]
  Bounds range     [1e+00, 1e+00]
  RHS range        [1e+00, 7e+00]
  QRHS range       [2e+01, 2e+01]
Presolve removed 24127 rows and 2058 columns
Presolve time: 1.25s
Presolved: 11597 rows, 1879 columns, 34259 nonzeros
Variable types: 719 continuous, 1160 integer (1160 binary)
Root relaxation presolved: 11284 rows, 1869 columns, 33600 nonzeros


Use crossover to convert LP symmetric solution to basic solution...

Root relaxation: objective 2.033900e+04, 2907 iterations, 1.01 seconds (0.26 work units)

    Nodes    |    Current Node    |     Objective Bounds      |     Work
 Expl Unexpl |  Obj  Depth IntInf | Incumbent    BestBd   Gap | It/Node Time

     0     0 20339.0000    0   62          - 20339.0000      -     -    4s
     0     0 20339.0000    0  181          - 20339.0000      -     -    6s
     0     0 20339.0000    0  169          - 20339.0000      -     -    7s
     0     0 20339.0000    0   17          - 20339.0000      -     -   10s
     0     0 20339.0000    0   17          - 20339.0000      -     -   10s
     0     0 20339.0000    0   53          - 20339.0000      -     -   11s
     0     0 20339.0000    0   59          - 20339.0000      -     -   12s
     0     0 20339.0000    0   34          - 20339.0000      -     -   14s
     0     0 20339.0000    0   47          - 20339.0000      -     -   14s
     0     0 20339.0000    0   44          - 20339.0000      -     -   15s
     0     0 20339.0000    0   40          - 20339.0000      -     -   16s
     0     0 20339.0000    0    4          - 20339.0000      -     -   17s
     0     0 20339.0000    0   32          - 20339.0000      -     -   18s
     0     0 20339.0000    0   13          - 20339.0000      -     -   19s
     0     2 20339.0000    0   12          - 20339.0000      -     -   21s
    57    88 20339.0000    6   43          - 20339.0000      -   539   25s
   178   269 20339.0000    9   62          - 20339.0000      -   447   30s
   883  1051 20265.3203   18   95          - 20339.0000      -   380   37s
  2301  1758 19459.0000   21   61          - 20339.0000      -   286   42s
  3089  2146 infeasible   22               - 20339.0000      -   266   46s
  4677  2468 17249.0000   23   13          - 20339.0000      -   244   63s
  4679  2469 16789.3229   15  186          - 20339.0000      -   244   72s
  4680  2470 18938.8072   11  172          - 20339.0000      -   244   78s
  4681  2471 20339.0000   13  195          - 20339.0000      -   244   82s
  4682  2471 19625.0000   30  114          - 20339.0000      -   244   87s
  4684  2473 20339.0000   11  131          - 20339.0000      -   244   96s
  4686  2474 19784.0000   22   98          - 20339.0000      -   244  103s
  4687  2475 19070.0000   30  132          - 20339.0000      -   244  105s
  4688  2475 19784.0000   17   78          - 20339.0000      -   244  110s
  4690  2477 19940.3557   26   50          - 20339.0000      -   243  115s

Cutting planes:
  Learned: 2
  Gomory: 5
  Lift-and-project: 2
  Cover: 23
  Clique: 6
  MIR: 38
  Flow cover: 77
  Inf proof: 1
  Zero half: 12
  RLT: 40
  Relax-and-lift: 2
  BQP: 26
  PSD: 6

Explored 4693 nodes (1210178 simplex iterations) in 120.04 seconds (23.36 work units)
Thread count was 32 (of 96 available processors)

Solution count 0

Time limit reached
Best objective -, best bound 2.033900000000e+04, gap -
Number of solutions found: 0
Set parameter WLSAccessID
Set parameter WLSSecret
Set parameter LicenseID to value 2687964
Academic license 2687964 - for non-commercial use only - registered to sa___@iict.buet.ac.bd
Set parameter TimeLimit to value 600
Set parameter PoolSearchMode to value 2
Set parameter PoolSolutions to value 1
Set parameter PoolGap to value 0
Gurobi Optimizer version 12.0.3 build v12.0.3rc0 (linux64 - "Rocky Linux 9.6 (Blue Onyx)")

CPU model: AMD EPYC 9454 48-Core Processor, instruction set [SSE2|AVX|AVX2|AVX512]
Thread count: 96 physical cores, 96 logical processors, using up to 32 threads

Non-default parameters:
TimeLimit  600
PoolSolutions  1
PoolSearchMode  2
PoolGap  0

Academic license 2687964 - for non-commercial use only - registered to sa___@iict.buet.ac.bd
Optimize a model with 35536 rows, 3843 columns and 103821 nonzeros
Model fingerprint: 0x67f89c54
Model has 266 quadratic constraints
Variable types: 2513 continuous, 1330 integer (1330 binary)
Coefficient statistics:
  Matrix range     [4e-02, 3e+05]
  QMatrix range    [1e+00, 1e+00]
  QLMatrix range   [2e+01, 2e+01]
  Objective range  [6e+02, 3e+03]
  Bounds range     [1e+00, 1e+00]
  RHS range        [1e+00, 7e+00]
  QRHS range       [2e+01, 2e+01]
Presolve removed 24127 rows and 2058 columns
Presolve time: 1.13s
Presolved: 11597 rows, 1879 columns, 34259 nonzeros
Variable types: 719 continuous, 1160 integer (1160 binary)
Root relaxation presolved: 11284 rows, 1869 columns, 33600 nonzeros


Use crossover to convert LP symmetric solution to basic solution...

Root relaxation: objective 2.033900e+04, 2907 iterations, 1.43 seconds (0.26 work units)

    Nodes    |    Current Node    |     Objective Bounds      |     Work
 Expl Unexpl |  Obj  Depth IntInf | Incumbent    BestBd   Gap | It/Node Time

     0     0 20339.0000    0   62          - 20339.0000      -     -    5s
     0     0 20339.0000    0  181          - 20339.0000      -     -    6s
     0     0 20339.0000    0  169          - 20339.0000      -     -    7s
     0     0 20339.0000    0   17          - 20339.0000      -     -    9s
     0     0 20339.0000    0   17          - 20339.0000      -     -    9s
     0     0 20339.0000    0   53          - 20339.0000      -     -   12s
     0     0 20339.0000    0   59          - 20339.0000      -     -   12s
     0     0 20339.0000    0   34          - 20339.0000      -     -   14s
     0     0 20339.0000    0   47          - 20339.0000      -     -   15s
     0     0 20339.0000    0   44          - 20339.0000      -     -   16s
     0     0 20339.0000    0   40          - 20339.0000      -     -   16s
     0     0 20339.0000    0    4          - 20339.0000      -     -   18s
     0     0 20339.0000    0   32          - 20339.0000      -     -   19s
     0     0 20339.0000    0   13          - 20339.0000      -     -   20s
     0     2 20339.0000    0   12          - 20339.0000      -     -   22s
    57    88 20339.0000    6   43          - 20339.0000      -   539   25s
   178   269 20339.0000    9   62          - 20339.0000      -   447   30s
   883  1051 20265.3203   18   95          - 20339.0000      -   380   36s
  2301  1758 19459.0000   21   61          - 20339.0000      -   286   41s
  3992  2467 20339.0000   16   87          - 20339.0000      -   246   46s
  4677  2468 17249.0000   23   13          - 20339.0000      -   244   60s
  4679  2469 16789.3229   15  186          - 20339.0000      -   244   70s
  4680  2470 18938.8072   11  172          - 20339.0000      -   244   77s
  4681  2471 20339.0000   13  195          - 20339.0000      -   244   81s
  4682  2471 19625.0000   30  114          - 20339.0000      -   244   85s
  4684  2473 20339.0000   11  131          - 20339.0000      -   244   94s
  4685  2473 20339.0000   17   78          - 20339.0000      -   244   95s
  4686  2474 19784.0000   22   98          - 20339.0000      -   244  101s
  4688  2475 19784.0000   17   78          - 20339.0000      -   244  107s
  4690  2477 19940.3557   26   50          - 20339.0000      -   243  112s
  4692  2478 18734.0000   20   63          - 20339.0000      -   243  115s
  4696  2481 19531.0000   23   41          - 20339.0000      -   243  120s
  4704  2486 20339.0000   12    9          - 20339.0000      -   243  128s
  4712  2500 20339.0000   16   48          - 20339.0000      -   254  130s
  4800  2612 20339.0000   20   50          - 20339.0000      -   255  136s
  5091  2749 20339.0000   24   65          - 20339.0000      -   254  140s
  5378  2780 20339.0000   26   42          - 20339.0000      -   252  146s
  5915  2816 20338.9958   36   14          - 20339.0000      -   245  150s
  6671  2765 20339.0000   23   20          - 20339.0000      -   242  155s
  7184  2750 20339.0000   27   71          - 20339.0000      -   241  160s
  8070  2785 infeasible   32               - 20339.0000      -   242  167s
  8808  2706 15147.4269   31   45          - 20339.0000      -   243  171s
  9161  2696 18745.0000   34   55          - 20339.0000      -   242  182s
  9898  2714 19459.0000   24   69          - 20339.0000      -   240  186s
 10792  2619 16119.0000   34   31          - 20339.0000      -   239  190s
 11673  2534 18745.0000   24   63          - 20339.0000      -   239  195s
 12513  2571 infeasible   29               - 20339.0000      -   240  202s
 12962  2673 20339.0000   29   76          - 20339.0000      -   240  206s
 13305  2795 19117.0000   25   59          - 20339.0000      -   242  211s
 14088  3103 20261.8841   25   81          - 20339.0000      -   246  217s
 14647  3149 17874.3939   23   81          - 20339.0000      -   245  225s
 15457  3446 infeasible   34               - 20339.0000      -   246  230s
 16526  3694 infeasible   23               - 20339.0000      -   246  238s
 17081  3910 19784.0000   32   59          - 20339.0000      -   246  240s
 18399  4206 infeasible   30               - 20339.0000      -   244  247s
 18891  4378 14661.0000   41   18          - 20339.0000      -   245  253s
 19599  4505 17881.7500   34  118          - 20339.0000      -   245  257s
 20294  4748 18745.0000   26   67          - 20339.0000      -   245  260s
 21844  5113 14680.9946   30   46          - 20339.0000      -   244  272s
 22661  5180 17432.0000   31   92          - 20339.0000      -   245  287s
 22938  5431 20339.0000   30   64          - 20339.0000      -   245  292s
 23909  5587 14624.0000   35   97          - 20339.0000      -   244  296s
 24787  5828 19625.0000   34   33          - 20339.0000      -   244  301s
 25749  6042 20339.0000   43   12          - 20339.0000      -   244  306s
 26585  6300 20339.0000   24   32          - 20339.0000      -   245  310s
 27645  6494 12991.0000   36   57          - 20339.0000      -   244  316s
 28591  6804 17925.0000   28   39          - 20339.0000      -   245  322s
 29881  7065 infeasible   43               - 20339.0000      -   244  329s
 31130  7255 infeasible   38               - 20339.0000      -   244  334s
 32184  7523 18949.0000   36   35          - 20339.0000      -   244  340s
 33389  7692 infeasible   38               - 20339.0000      -   244  346s
 34351  7976 20339.0000   28   36          - 20339.0000      -   246  359s
 35770  8183 infeasible   33               - 20339.0000      -   245  365s
 37109  8489 19117.0000   35   31          - 20339.0000      -   245  371s
 38707  8731 14183.0000   36   34          - 20339.0000      -   244  378s
 40098  8993 19625.0000   37   77          - 20339.0000      -   244  384s
 41690  9036 infeasible   30               - 20339.0000      -   243  405s
 42022  9423 20338.7192   32  119          - 20339.0000      -   243  411s
 44248  9696 infeasible   31               - 20339.0000      -   240  418s
 45940 10163 infeasible   38               - 20339.0000      -   239  424s
 47563 10443 infeasible   32               - 20339.0000      -   239  431s
 49163 10871 19781.8217   35  148          - 20339.0000      -   240  439s
 51220 11180 infeasible   38               - 20339.0000      -   239  447s
 53218 11626 17477.0000   29   25          - 20336.3247      -   238  455s
 55312 12046 18948.0000   44   79          - 20310.3071      -   238  464s
 57264 12397 infeasible   42               - 20310.3071      -   238  475s

Cutting planes:
  Learned: 1
  Gomory: 2
  Cover: 14
  Clique: 6
  MIR: 9
  Flow cover: 25
  Inf proof: 33
  Zero half: 5
  RLT: 24
  Relax-and-lift: 2
  BQP: 15
  PSD: 4

Explored 59386 nodes (14150324 simplex iterations) in 600.27 seconds (137.45 work units)
Thread count was 32 (of 96 available processors)

Solution count 0

Time limit reached
Best objective -, best bound 2.031000000000e+04, gap -
Number of solutions found: 0
CLONES: 17 , SOLUTION COUNT: 0
Set parameter WLSAccessID
Set parameter WLSSecret
Set parameter LicenseID to value 2687964
Academic license 2687964 - for non-commercial use only - registered to sa___@iict.buet.ac.bd
Set parameter TimeLimit to value 120
Set parameter PoolSearchMode to value 2
Set parameter PoolSolutions to value 1
Set parameter PoolGap to value 0
Gurobi Optimizer version 12.0.3 build v12.0.3rc0 (linux64 - "Rocky Linux 9.6 (Blue Onyx)")

CPU model: AMD EPYC 9454 48-Core Processor, instruction set [SSE2|AVX|AVX2|AVX512]
Thread count: 96 physical cores, 96 logical processors, using up to 32 threads

Non-default parameters:
TimeLimit  120
PoolSolutions  1
PoolSearchMode  2
PoolGap  0

Academic license 2687964 - for non-commercial use only - registered to sa___@iict.buet.ac.bd
Optimize a model with 34091 rows, 3684 columns and 99577 nonzeros
Model fingerprint: 0xddad9bde
Model has 266 quadratic constraints
Variable types: 2373 continuous, 1311 integer (1311 binary)
Coefficient statistics:
  Matrix range     [4e-02, 3e+05]
  QMatrix range    [1e+00, 1e+00]
  QLMatrix range   [2e+01, 2e+01]
  Objective range  [6e+02, 3e+03]
  Bounds range     [1e+00, 1e+00]
  RHS range        [1e+00, 7e+00]
  QRHS range       [2e+01, 2e+01]
Presolve removed 23295 rows and 1955 columns
Presolve time: 1.03s
Presolved: 10974 rows, 1818 columns, 32379 nonzeros
Variable types: 677 continuous, 1141 integer (1141 binary)
Root relaxation presolved: 10666 rows, 1813 columns, 31730 nonzeros


Use crossover to convert LP symmetric solution to basic solution...

Root relaxation: objective 2.033900e+04, 2206 iterations, 0.72 seconds (0.14 work units)

    Nodes    |    Current Node    |     Objective Bounds      |     Work
 Expl Unexpl |  Obj  Depth IntInf | Incumbent    BestBd   Gap | It/Node Time

     0     0 20339.0000    0  158          - 20339.0000      -     -    3s
     0     0 20339.0000    0  178          - 20339.0000      -     -    6s
     0     0 20339.0000    0  141          - 20339.0000      -     -    6s
     0     0 20339.0000    0   79          - 20339.0000      -     -   10s
     0     0 20339.0000    0   60          - 20339.0000      -     -   10s
     0     0 20339.0000    0   61          - 20339.0000      -     -   16s
     0     0 20339.0000    0   84          - 20339.0000      -     -   19s
     0     0 20339.0000    0   64          - 20339.0000      -     -   23s
     0     0 20339.0000    0   49          - 20339.0000      -     -   23s
     0     0 20339.0000    0   26          - 20339.0000      -     -   24s
     0     0 20339.0000    0   24          - 20339.0000      -     -   24s
     0     0 20339.0000    0   65          - 20339.0000      -     -   27s
     0     0 20339.0000    0   43          - 20339.0000      -     -   27s
     0     0 20339.0000    0   14          - 20339.0000      -     -   28s
     0     0 20339.0000    0   35          - 20339.0000      -     -   28s
     0     0 20339.0000    0   16          - 20339.0000      -     -   29s
     0     0 20339.0000    0   47          - 20339.0000      -     -   29s
     0     0 20339.0000    0   16          - 20339.0000      -     -   31s
     0     0 20339.0000    0   16          - 20339.0000      -     -   31s
     0     2 20339.0000    0   16          - 20339.0000      -     -   38s
    15    32 20339.0000    4   87          - 20339.0000      -   581   41s
    63    92 20312.4829    6  262          - 20339.0000      -   720   45s
   252   352 19428.1043   10  104          - 20339.0000      -   497   50s
   760   803 20339.0000   10   66          - 20339.0000      -   362   55s
  1610  1230 20156.2369   12  156          - 20339.0000      -   274   62s
  2027  1455 19784.0000   15   60          - 20339.0000      -   265   65s
  3037  2060 19540.7507   15   92          - 20339.0000      -   250   70s
  4542  2644 20243.4631   11  210          - 20339.0000      -   223   75s
* 4993  2037              20    20339.000000 20339.0000  0.00%   222   75s

Cutting planes:
  Learned: 9
  Gomory: 11
  Cover: 304
  Implied bound: 39
  Clique: 25
  MIR: 115
  StrongCG: 2
  Flow cover: 109
  GUB cover: 1
  Inf proof: 1
  Zero half: 32
  Network: 1
  RLT: 160
  Relax-and-lift: 35
  BQP: 26

Explored 5179 nodes (1175964 simplex iterations) in 75.33 seconds (15.41 work units)
Thread count was 32 (of 96 available processors)

Solution count 1: 20339 
No other solutions better than 20339

Optimal solution found (tolerance 1.00e-04)
Best objective 2.033900000000e+04, best bound 2.033900000000e+04, gap 0.0000%
Number of solutions found: 1
Solution 1:
Objective value: 20339.0
CLONES: 16 , SOLUTION COUNT: 1
Set parameter WLSAccessID
Set parameter WLSSecret
Set parameter LicenseID to value 2687964
Academic license 2687964 - for non-commercial use only - registered to sa___@iict.buet.ac.bd
Set parameter TimeLimit to value 43200
Set parameter PoolSearchMode to value 2
Set parameter PoolSolutions to value 250
Set parameter PoolGap to value 0
Gurobi Optimizer version 12.0.3 build v12.0.3rc0 (linux64 - "Rocky Linux 9.6 (Blue Onyx)")

CPU model: AMD EPYC 9454 48-Core Processor, instruction set [SSE2|AVX|AVX2|AVX512]
Thread count: 96 physical cores, 96 logical processors, using up to 32 threads

Non-default parameters:
TimeLimit  43200
PoolSolutions  250
PoolSearchMode  2
PoolGap  0

Academic license 2687964 - for non-commercial use only - registered to sa___@iict.buet.ac.bd
Optimize a model with 34091 rows, 3684 columns and 99577 nonzeros
Model fingerprint: 0xddad9bde
Model has 266 quadratic constraints
Variable types: 2373 continuous, 1311 integer (1311 binary)
Coefficient statistics:
  Matrix range     [4e-02, 3e+05]
  QMatrix range    [1e+00, 1e+00]
  QLMatrix range   [2e+01, 2e+01]
  Objective range  [6e+02, 3e+03]
  Bounds range     [1e+00, 1e+00]
  RHS range        [1e+00, 7e+00]
  QRHS range       [2e+01, 2e+01]
Presolve removed 23295 rows and 1955 columns
Presolve time: 1.30s
Presolved: 10974 rows, 1818 columns, 32379 nonzeros
Variable types: 677 continuous, 1141 integer (1141 binary)
Root relaxation presolved: 10666 rows, 1813 columns, 31730 nonzeros


Use crossover to convert LP symmetric solution to basic solution...

Root relaxation: objective 2.033900e+04, 2206 iterations, 0.94 seconds (0.14 work units)

    Nodes    |    Current Node    |     Objective Bounds      |     Work
 Expl Unexpl |  Obj  Depth IntInf | Incumbent    BestBd   Gap | It/Node Time

     0     0 20339.0000    0  158          - 20339.0000      -     -    4s
     0     0 20339.0000    0  178          - 20339.0000      -     -    7s
     0     0 20339.0000    0  141          - 20339.0000      -     -    8s
     0     0 20339.0000    0   79          - 20339.0000      -     -   12s
     0     0 20339.0000    0   60          - 20339.0000      -     -   12s
     0     0 20339.0000    0   61          - 20339.0000      -     -   18s
     0     0 20339.0000    0   84          - 20339.0000      -     -   21s
     0     0 20339.0000    0   64          - 20339.0000      -     -   25s
     0     0 20339.0000    0   49          - 20339.0000      -     -   25s
     0     0 20339.0000    0   26          - 20339.0000      -     -   26s
     0     0 20339.0000    0   24          - 20339.0000      -     -   27s
     0     0 20339.0000    0   65          - 20339.0000      -     -   29s
     0     0 20339.0000    0   43          - 20339.0000      -     -   29s
     0     0 20339.0000    0   14          - 20339.0000      -     -   30s
     0     0 20339.0000    0   35          - 20339.0000      -     -   30s
     0     0 20339.0000    0   16          - 20339.0000      -     -   31s
     0     0 20339.0000    0   47          - 20339.0000      -     -   31s
     0     0 20339.0000    0   16          - 20339.0000      -     -   32s
     0     0 20339.0000    0   16          - 20339.0000      -     -   33s
     0     2 20339.0000    0   16          - 20339.0000      -     -   39s
     3     8 20339.0000    2   83          - 20339.0000      -   989   40s
    95   245 20216.6060    7  217          - 20339.0000      -   676   47s
   566   590 20339.0000    9   91          - 20339.0000      -   391   51s
  1119  1041 20004.6296   11   77          - 20339.0000      -   312   55s
  2027  1455 19784.0000   15   60          - 20339.0000      -   265   60s
  3037  2060 19540.7507   15   92          - 20339.0000      -   250   65s
  4542  2644 20243.4631   11  210          - 20339.0000      -   223   70s
* 4993  2037              20    20339.000000 20339.0000  0.00%   222   70s

Optimal solution found at node 5179 - now completing solution pool...
  5180   641 20339.0000   15   16          - 20339.0000      -   220   72s
Total elapsed time = 75.28s (DegenMoves)
Total elapsed time = 80.17s (DegenMoves)
Total elapsed time = 86.11s (DegenMoves)

Cutting planes:
  Gomory: 3
  Cover: 7
  Implied bound: 15
  MIR: 2
  Flow cover: 18
  GUB cover: 2
  Zero half: 2
  RLT: 11
  Relax-and-lift: 8
  BQP: 8

Explored 5442 nodes (1213152 simplex iterations) in 89.01 seconds (18.46 work units)
Thread count was 32 (of 96 available processors)

Solution count 2: 20339 20339 
No other solutions better than 20339

Optimal solution found (tolerance 1.00e-04)
Best objective 2.033900000000e+04, best bound 2.033900000000e+04, gap 0.0000%
Number of solutions found: 2
Solution 1:
Objective value: 20339.0
Solution 2:
Objective value: 20339.0
0
1
