clone_id
O    1708
B    1584
D    1246
Q     974
G     415
N     359
E     237
I     184
J     122
M     120
K     105
C      94
A      92
H      64
L      59
P      49
F      33
Name: count, dtype: int64
clone_id
O    0.229416
B    0.212760
D    0.167361
Q    0.130826
G    0.055742
N    0.048220
E    0.031833
I    0.024715
J    0.016387
M    0.016118
K    0.014103
C    0.012626
A    0.012357
H    0.008596
L    0.007925
P    0.006582
F    0.004433
Name: count, dtype: float64
0.018518518518518517
['B', 'D', 'E', 'G', 'I', 'N', 'O', 'Q']
   B  N  O  Q
B  0  0  1  1
N  1  0  1  1
O  1  0  0  1
Q  1  0  1  0
                 0    1      2    3  ...   16   17        18        19
clone_id                             ...                              
B         0.782609  1.0  0.625  1.0  ...  0.5  1.0  0.731183  1.000000
N         0.000000  0.0  0.000  0.0  ...  0.0  0.0  0.000000  0.000000
O         0.000000  1.0  0.000  1.0  ...  0.0  0.0  1.000000  0.666667
Q         0.000000  1.0  1.000  0.0  ...  0.0  0.0  1.000000  0.000000

[4 rows x 20 columns]
TRYING 21 CLONES
Set parameter WLSAccessID
Set parameter WLSSecret
Set parameter LicenseID to value 2687964
Academic license 2687964 - for non-commercial use only - registered to sa___@iict.buet.ac.bd
Set parameter TimeLimit to value 86400
Gurobi Optimizer version 12.0.3 build v12.0.3rc0 (linux64 - "Rocky Linux 9.6 (Blue Onyx)")

CPU model: AMD EPYC 7702 64-Core Processor, instruction set [SSE2|AVX|AVX2]
Thread count: 128 physical cores, 128 logical processors, using up to 32 threads

Non-default parameters:
TimeLimit  86400

Academic license 2687964 - for non-commercial use only - registered to sa___@iict.buet.ac.bd
Optimize a model with 36546 rows, 3244 columns and 107853 nonzeros
Model fingerprint: 0xa3df9e20
Model has 160 quadratic constraints
Variable types: 1844 continuous, 1400 integer (1400 binary)
Coefficient statistics:
  Matrix range     [1e-01, 5e+05]
  QMatrix range    [1e+00, 1e+00]
  QLMatrix range   [2e+01, 2e+01]
  Objective range  [3e+02, 4e+03]
  Bounds range     [1e+00, 1e+00]
  RHS range        [1e+00, 4e+00]
  QRHS range       [2e+01, 2e+01]
Presolve removed 28118 rows and 2040 columns
Presolve time: 3.12s
Presolved: 8486 rows, 1233 columns, 26306 nonzeros
Variable types: 607 continuous, 626 integer (624 binary)

Root simplex log...

Iteration    Objective       Primal Inf.    Dual Inf.      Time
    1320    1.9749749e+04   1.495321e+03   0.000000e+00      5s
    2839    1.9749750e+04   0.000000e+00   0.000000e+00      9s
    2839    1.9749750e+04   0.000000e+00   0.000000e+00      9s

Root relaxation: objective 1.974975e+04, 2839 iterations, 5.61 seconds (0.36 work units)
Total elapsed time = 11.44s (DegenMoves)
Total elapsed time = 15.38s (DegenMoves)

    Nodes    |    Current Node    |     Objective Bounds      |     Work
 Expl Unexpl |  Obj  Depth IntInf | Incumbent    BestBd   Gap | It/Node Time

     0     0 19749.7500    0  174          - 19749.7500      -     -   20s
     0     0 18355.5000    0  143          - 18355.5000      -     -   25s
     0     0 17757.0000    0  126          - 17757.0000      -     -   25s
     0     0 17757.0000    0   95          - 17757.0000      -     -   28s
     0     0 17757.0000    0   77          - 17757.0000      -     -   29s
     0     0 17757.0000    0   78          - 17757.0000      -     -   30s
     0     0 17757.0000    0   68          - 17757.0000      -     -   31s
     0     0 17757.0000    0   42          - 17757.0000      -     -   34s
     0     0 17757.0000    0   51          - 17757.0000      -     -   35s
     0     0 17757.0000    0   33          - 17757.0000      -     -   38s
     0     0 17757.0000    0   51          - 17757.0000      -     -   38s
     0     0 17757.0000    0   22          - 17757.0000      -     -   39s
     0     0 17757.0000    0   30          - 17757.0000      -     -   40s
     0     0 17757.0000    0   38          - 17757.0000      -     -   41s
     0     0 17757.0000    0   35          - 17757.0000      -     -   41s
     0     0 17757.0000    0   22          - 17757.0000      -     -   43s
     0     0 17757.0000    0   44          - 17757.0000      -     -   43s
     0     0 17757.0000    0   24          - 17757.0000      -     -   46s
     0     0 17757.0000    0   35          - 17757.0000      -     -   46s
     0     0 17757.0000    0   28          - 17757.0000      -     -   49s
     0     0 17757.0000    0   28          - 17757.0000      -     -   51s
     0     2 17757.0000    0   28          - 17757.0000      -     -   66s
    31    52 17757.0000    5   49          - 17757.0000      -   420   70s
   282   271 17689.3670   10   79          - 17757.0000      -   205   76s
   717   463 16812.6949   15  151          - 17757.0000      -   156   81s
  1304   657 infeasible   13               - 17757.0000      -   135   85s
  1908   835 17260.2656   10   39          - 17757.0000      -   126   90s
  2665  1048 infeasible   14               - 17757.0000      -   118   95s
  3315  1263 infeasible   24               - 17757.0000      -   117  100s
  4110  1535 17743.5640   18   84          - 17757.0000      -   116  105s
  4874  1777 14092.2292   31  125          - 17757.0000      -   113  110s
  5805  2018 14093.0000   18   28          - 17757.0000      -   115  118s
  5807  2019 16959.1274   14  148          - 17757.0000      -   115  142s
  5808  2020 13792.8849   12   75          - 17757.0000      -   115  149s
  5809  2021 14093.0000    8   87          - 17757.0000      -   115  152s
  5810  2021 9510.00000   13   95          - 17757.0000      -   115  161s
  5811  2022 17615.0000   19   79          - 17757.0000      -   115  165s
  5812  2023 15561.0000   19  112          - 17757.0000      -   115  176s
  5814  2024 16128.0000   19   88          - 17757.0000      -   115  186s
  5816  2025 17615.0000   14   48          - 17757.0000      -   115  192s
  5818  2027 17289.0000    7   99          - 17757.0000      -   115  202s
  5820  2028 16445.3002   13   71          - 17757.0000      -   115  213s
  5821  2029 13625.0000   27   88          - 17757.0000      -   115  215s
  5822  2029 17301.9009   13   38          - 17757.0000      -   115  221s
  5824  2031 16176.5857   25   35          - 17757.0000      -   115  234s
  5825  2031 17234.0000   16   51          - 17757.0000      -   115  235s
  5826  2032 17615.0000   19   44          - 17757.0000      -   115  240s
  5827  2033 17375.2312    9   38          - 17757.0000      -   115  263s
  5828  2033 17615.0000   19   38          - 17757.0000      -   115  274s
  5829  2037 17757.0000   12   35          - 17757.0000      -   7.7  277s
  5835  2047 17757.0000   14   57          - 17757.0000      -   8.0  281s
  5859  2085 17757.0000   16   73          - 17757.0000      -   9.9  286s
  5923  2139 17614.6031   18   98          - 17757.0000      -  14.3  291s
  6182  2163 13005.0000   21   32          - 17757.0000      -  20.7  296s
  6384  2184 9341.00000   23   34          - 17757.0000      -  24.8  301s
  6528  2185 12870.2941   23   43          - 17757.0000      -  28.6  306s
  6669  2188 17742.3625   26   93          - 17757.0000      -  32.7  310s
  6877  2179 infeasible   27               - 17757.0000      -  39.2  315s
  6975  2167 17755.9285   22  115          - 17757.0000      -  42.1  322s
  7150  2146 17232.1719   24   85          - 17757.0000      -  47.5  326s
  7354  2128 infeasible   26               - 17757.0000      -  53.9  331s
  7774  2040 infeasible   37               - 17757.0000      -  61.9  346s
  8042  1981 13481.0000   18   58          - 17757.0000      -  67.1  350s
  8408  1957 infeasible   30               - 17756.9995      -  72.0  355s
  8768  1933 infeasible   26               - 17748.1901      -  78.0  360s
  9368  1820 12679.0000   21   52          - 17744.4609      -  84.8  367s
  9662  1744 infeasible   23               - 17744.4609      -  86.5  370s
 10210  1640 17288.8824   21   74          - 17701.3281      -  90.9  387s
 10353  1635 16955.0000   23   44          - 17701.3281      -  92.5  391s
 10875  1562 17289.0000   22   27          - 17615.0000      -  98.0  397s
 11172  1479 17609.2703   32   84          - 17615.0000      -   100  400s
 11444  1467 infeasible   29               - 17615.0000      -   103  405s
 12180  1453 infeasible   34               - 17615.0000      -   107  411s
 12592  1532 infeasible   31               - 17615.0000      -   109  415s
 13264  1553 infeasible   33               - 17615.0000      -   112  422s
 13658  1567 17281.0000   26   28          - 17615.0000      -   115  426s
 14570  1519 infeasible   23               - 17615.0000      -   118  434s
 15078  1511 infeasible   24               - 17615.0000      -   119  454s
 15334  1515 infeasible   28               - 17614.7898      -   120  458s
 15871  1551 infeasible   23               - 17569.8115      -   122  463s
 16400  1612 17234.0000   20   61          - 17569.8115      -   124  468s
 17075  1638 16258.0000   25   44          - 17288.8824      -   125  475s
 17777  1649 12594.0000   29   52          - 17234.0000      -   126  480s
 18242  1664 16900.0000   22   50          - 17234.0000      -   127  486s
 19011  1642 infeasible   29               - 17234.0000      -   127  493s
 19772  1580 infeasible   30               - 17032.2751      -   128  500s
 20545  1493 12231.0000   26   61          - 16900.0000      -   130  506s
 21334  1408 12594.0000   32   45          - 16581.5313      -   130  512s
 22062  1404 15186.8438   26   48          - 16119.5625      -   132  519s
 22714  1423 infeasible   29               - 15819.3906      -   134  527s
 23340  1420 14704.0000   40   37          - 15680.0000      -   135  533s
 24141  1367 infeasible   24               - 15602.0000      -   137  541s
 24989  1307 15144.8751   23   87          - 15528.1727      -   138  548s
 25915  1260 10705.0000   25   47          - 15299.0000      -   139  557s
 26675  1278 12000.7500   24   63          - 15150.1636      -   141  590s
 26971  1247 11040.0000   29   43          - 14683.0000      -   142  599s
 27905  1163 infeasible   26               - 14093.0000      -   143  609s
 28695  1099 13292.2016   29   82          - 13949.9331      -   145  620s
 30127  1024 13759.0000   26   56          - 13759.0000      -   145  632s
 31516   942 9313.00000   24   54          - 13005.0000      -   145  643s
 32923   851 infeasible   28               - 12957.9285      -   145  653s
 33950   761 11817.3833   23  164          - 12231.0000      -   147  664s
 35363   589 11488.5000   31   40          - 11856.1389      -   147  675s
 36795   282 10817.0000   35   19          - 11285.0000      -   148  688s
 38410    10 9483.00000   28   54          - 10148.0000      -   148  701s

Cutting planes:
  Learned: 16
  Gomory: 11
  Cover: 462
  Implied bound: 22
  Projected implied bound: 1
  Clique: 1
  MIR: 105
  Mixing: 1
  StrongCG: 2
  Flow cover: 237
  Inf proof: 14
  Zero half: 16
  RLT: 109
  Relax-and-lift: 6
  BQP: 3
  PSD: 1

Explored 39639 nodes (6505271 simplex iterations) in 704.65 seconds (53.14 work units)
Thread count was 32 (of 128 available processors)

Solution count 0
No other solutions better than -1e+100

Model is infeasible
Best objective -, best bound -, gap -
TRYING 20 CLONES
Set parameter WLSAccessID
Set parameter WLSSecret
Set parameter LicenseID to value 2687964
Academic license 2687964 - for non-commercial use only - registered to sa___@iict.buet.ac.bd
Set parameter TimeLimit to value 86400
Gurobi Optimizer version 12.0.3 build v12.0.3rc0 (linux64 - "Rocky Linux 9.6 (Blue Onyx)")

CPU model: AMD EPYC 7702 64-Core Processor, instruction set [SSE2|AVX|AVX2]
Thread count: 128 physical cores, 128 logical processors, using up to 32 threads

Non-default parameters:
TimeLimit  86400

Academic license 2687964 - for non-commercial use only - registered to sa___@iict.buet.ac.bd
Optimize a model with 35145 rows, 3140 columns and 103689 nonzeros
Model fingerprint: 0xe7f6aaec
Model has 160 quadratic constraints
Variable types: 1760 continuous, 1380 integer (1380 binary)
Coefficient statistics:
  Matrix range     [1e-01, 5e+05]
  QMatrix range    [1e+00, 1e+00]
  QLMatrix range   [2e+01, 2e+01]
  Objective range  [3e+02, 4e+03]
  Bounds range     [1e+00, 1e+00]
  RHS range        [1e+00, 4e+00]
  QRHS range       [2e+01, 2e+01]
Presolve removed 27159 rows and 1983 columns
Presolve time: 4.22s
Presolved: 8038 rows, 1183 columns, 24933 nonzeros
Variable types: 577 continuous, 606 integer (604 binary)

Root simplex log...

Iteration    Objective       Primal Inf.    Dual Inf.      Time
     599    1.9749750e+04   7.429735e+03   0.000000e+00      5s
    2706    1.9749750e+04   0.000000e+00   0.000000e+00      9s
    2706    1.9749750e+04   0.000000e+00   0.000000e+00      9s

Root relaxation: objective 1.974975e+04, 2706 iterations, 4.80 seconds (0.39 work units)
Total elapsed time = 13.35s (DegenMoves)
Total elapsed time = 17.87s (DegenMoves)
Total elapsed time = 20.06s (DegenMoves)

    Nodes    |    Current Node    |     Objective Bounds      |     Work
 Expl Unexpl |  Obj  Depth IntInf | Incumbent    BestBd   Gap | It/Node Time

     0     0 19749.7500    0  166          - 19749.7500      -     -   21s
     0     0 18355.5000    0  141          - 18355.5000      -     -   25s
     0     0 17757.0000    0   90          - 17757.0000      -     -   31s
     0     0 17757.0000    0   81          - 17757.0000      -     -   32s
     0     0 17757.0000    0   76          - 17757.0000      -     -   33s
     0     0 17757.0000    0   86          - 17757.0000      -     -   34s
     0     0 17757.0000    0   56          - 17757.0000      -     -   40s
     0     0 17757.0000    0   79          - 17757.0000      -     -   41s
     0     0 17757.0000    0   56          - 17757.0000      -     -   46s
     0     0 17757.0000    0   49          - 17757.0000      -     -   48s
     0     0 17757.0000    0   51          - 17757.0000      -     -   51s
     0     0 17757.0000    0   67          - 17757.0000      -     -   52s
     0     0 17757.0000    0   80          - 17757.0000      -     -   57s
     0     0 17757.0000    0   76          - 17757.0000      -     -   57s
     0     0 17757.0000    0   69          - 17757.0000      -     -   63s
     0     0 17757.0000    0   49          - 17757.0000      -     -   66s
     0     2 17757.0000    0   35          - 17757.0000      -     -   85s
    61    87 17755.9112    6  163          - 17757.0000      -   376   91s
   353   287 17234.0000    9   59          - 17757.0000      -   217   95s
   822   479 17234.0000   14   60          - 17757.0000      -   164  100s
  1381   718 14092.8812   14  170          - 17757.0000      -   141  106s
  1971   937 14093.0000   19   46          - 17757.0000      -   132  110s
  2898  1159 13442.6875   15   39          - 17757.0000      -   122  115s
  4157  1326 17615.0000   14   36          - 17757.0000      -   106  120s
  5337  1656 13440.4056   23   49          - 17722.9696      -   105  126s
  5339  1657 16651.0000   13  191          - 17722.9696      -   105  153s
  5340  1658 17613.3056   14   67          - 17722.9696      -   104  163s
  5341  1659 16955.0000   18   84          - 17722.9696      -   104  166s
  5342  1659 12679.0000   17   82          - 17722.9696      -   104  176s
  5344  1661 16781.0000   20   68          - 17722.9696      -   104  187s
  5345  1661 17234.0000    8   95          - 17722.9696      -   104  190s
  5346  1662 13625.0000   24   93          - 17722.9696      -   104  198s
  5348  1663 17632.0764   10   36          - 17722.9696      -   104  204s
  5349  1664 16278.5000   24   65          - 17722.9696      -   104  206s
  5350  1665 17234.0000    8   57          - 17722.9696      -   104  220s
  5352  1666 17289.0000   17   12          - 17722.9696      -   104  225s
  5354  1667 17534.1074    9   26          - 17722.9696      -   104  237s
  5356  1669 14093.0000   19   54          - 17722.9696      -   104  243s
  5357  1669 16639.0000   24   75          - 17722.9696      -   104  245s
  5358  1670 17049.1818   17   56          - 17722.9696      -   104  253s
  5359  1671 16781.0000   10   49          - 17722.9696      -   104  282s
  5360  1671 16781.0000   12   49          - 17615.0000      -   104  297s
  5361  1675 17615.0000   11   47          - 17615.0000      -   8.8  304s
  5363  1677 17615.0000   12   46          - 17615.0000      -   9.3  307s
  5374  1692 17615.0000   14   43          - 17615.0000      -  10.2  310s
  5445  1727 17568.2000   17   77          - 17615.0000      -  12.8  317s
  5523  1737 16758.6000   18  145          - 17615.0000      -  15.5  321s
  5592  1747 12870.9498   19  102          - 17615.0000      -  17.9  327s
  5721  1764 12517.8438   21   37          - 17615.0000      -  23.7  330s
  6022  1741 12649.0000   24   43          - 17615.0000      -  31.2  337s
  6152  1721 17590.0000   24   44          - 17615.0000      -  35.3  341s
  6306  1710 infeasible   30               - 17615.0000      -  40.2  345s
  6573  1692 17320.0000   27   15          - 17615.0000      -  48.1  356s
  6900  1664 16344.0000   29   33          - 17615.0000      -  56.5  361s
  7228  1634 17615.0000   21  120          - 17615.0000      -  61.0  366s
  7573  1561 infeasible   24               - 17615.0000      -  66.1  374s
  7656  1563 16767.2500   26   76          - 17615.0000      -  67.8  376s
  8040  1531 infeasible   27               - 17615.0000      -  72.8  381s
  8477  1426 infeasible   31               - 17615.0000      -  77.8  386s
  8918  1344 17615.0000   22   50          - 17615.0000      -  82.9  391s
  9362  1223 17461.9998   25   52          - 17615.0000      -  88.7  397s
  9619  1151 17429.2538   28   71          - 17615.0000      -  91.3  400s
 10039  1151 17614.7765   31   75          - 17615.0000      -  96.0  415s
 10469  1128 17281.0000   29   36          - 17615.0000      -   101  420s
 11080  1245 infeasible   26               - 17615.0000      -   105  426s
 11814  1273 17600.2121   35   54          - 17615.0000      -   109  432s
 12158  1263 infeasible   38               - 17615.0000      -   112  435s
 12956  1301 infeasible   32               - 17610.6860      -   116  442s
 13256  1295 11897.0000   31   39          - 17581.5343      -   117  446s
 13701  1340 17234.0000   26   47          - 17288.9913      -   119  450s
 14701  1365 infeasible   34               - 17234.0000      -   123  457s
 15260  1388 13275.0000   33   37          - 17234.0000      -   124  479s
 15545  1366 13275.0000   34   36          - 17234.0000      -   125  484s
 16195  1402 16765.9949   27   65          - 17072.9682      -   126  488s
 16897  1319 13477.9084   28  112          - 16939.0000      -   127  492s
 17511  1294 16388.9996   27   58          - 16781.0000      -   129  496s
 18033  1249 16388.9996   32   31          - 16755.4575      -   130  501s
 18704  1257 infeasible   32               - 16604.3885      -   132  506s
 19436  1225 infeasible   18               - 16577.1716      -   133  510s
 20129  1228 infeasible   28               - 15895.0000      -   135  516s
 20828  1241 12975.0000   28   36          - 15532.0000      -   137  521s
 21620  1238 infeasible   26               - 14919.0000      -   139  528s
 22227  1249 infeasible   29               - 14093.0000      -   141  534s
 22729  1274 13866.2925   27   74          - 14093.0000      -   144  540s
 23306  1246 infeasible   31               - 14093.0000      -   146  548s
 24055  1208 infeasible   30               - 13951.0000      -   149  554s
 24889  1158 infeasible   27               - 13867.4171      -   151  564s
 25841  1154 13312.9539   32   64          - 13570.0000      -   152  572s
 27030  1054 infeasible   34               - 13338.9520      -   153  582s
 27768  1071 infeasible   39               - 13147.0000      -   155  591s
 28767  1027 infeasible   27               - 13005.0000      -   157  601s
 29984   859 infeasible   28               - 12975.0000      -   158  610s
 31075   757 infeasible   34               - 12975.0000      -   160  621s
 32260   541 11255.0000   29   65          - 12284.8996      -   161  631s
 33416   418 12231.0000   26   91          - 12231.0000      -   162  652s
 34322   252 12231.0000   25   66          - 12231.0000      -   162  664s
 35691    31 infeasible   28               - 12231.0000      -   163  677s
 36759     0 infeasible   35               - 8873.00000      -   162  683s

Cutting planes:
  Learned: 10
  Gomory: 10
  Lift-and-project: 7
  Cover: 332
  Implied bound: 17
  Projected implied bound: 3
  Clique: 1
  MIR: 90
  Mixing: 1
  StrongCG: 3
  Flow cover: 157
  GUB cover: 2
  Inf proof: 15
  Zero half: 30
  RLT: 76
  Relax-and-lift: 13
  BQP: 23
  PSD: 2

Explored 36993 nodes (6570180 simplex iterations) in 683.93 seconds (55.56 work units)
Thread count was 32 (of 128 available processors)

Solution count 0
No other solutions better than -1e+100

Model is infeasible
Best objective -, best bound -, gap -
TRYING 19 CLONES
Set parameter WLSAccessID
Set parameter WLSSecret
Set parameter LicenseID to value 2687964
Academic license 2687964 - for non-commercial use only - registered to sa___@iict.buet.ac.bd
Set parameter TimeLimit to value 86400
Gurobi Optimizer version 12.0.3 build v12.0.3rc0 (linux64 - "Rocky Linux 9.6 (Blue Onyx)")

CPU model: AMD EPYC 7702 64-Core Processor, instruction set [SSE2|AVX|AVX2]
Thread count: 128 physical cores, 128 logical processors, using up to 32 threads

Non-default parameters:
TimeLimit  86400

Academic license 2687964 - for non-commercial use only - registered to sa___@iict.buet.ac.bd
Optimize a model with 33744 rows, 3036 columns and 99525 nonzeros
Model fingerprint: 0xf9f88465
Model has 160 quadratic constraints
Variable types: 1676 continuous, 1360 integer (1360 binary)
Coefficient statistics:
  Matrix range     [1e-01, 5e+05]
  QMatrix range    [1e+00, 1e+00]
  QLMatrix range   [2e+01, 2e+01]
  Objective range  [3e+02, 4e+03]
  Bounds range     [1e+00, 1e+00]
  RHS range        [1e+00, 4e+00]
  QRHS range       [2e+01, 2e+01]
Presolve removed 26128 rows and 1922 columns
Presolve time: 3.76s
Presolved: 7670 rows, 1141 columns, 23759 nonzeros
Variable types: 547 continuous, 594 integer (592 binary)

Root simplex log...

Iteration    Objective       Primal Inf.    Dual Inf.      Time
    1040    1.9749750e+04   2.219632e+04   0.000000e+00      5s
    2495    1.9749750e+04   0.000000e+00   0.000000e+00      8s
    2495    1.9749750e+04   0.000000e+00   0.000000e+00      8s

Root relaxation: objective 1.974975e+04, 2495 iterations, 3.53 seconds (0.30 work units)
Total elapsed time = 12.38s (DegenMoves)
Total elapsed time = 15.68s (DegenMoves)

    Nodes    |    Current Node    |     Objective Bounds      |     Work
 Expl Unexpl |  Obj  Depth IntInf | Incumbent    BestBd   Gap | It/Node Time

     0     0 19749.7500    0  168          - 19749.7500      -     -   17s
     0     0 18355.5000    0  102          - 18355.5000      -     -   20s
     0     0 17757.0000    0  100          - 17757.0000      -     -   20s
     0     0 17757.0000    0   93          - 17757.0000      -     -   23s
     0     0 17757.0000    0   78          - 17757.0000      -     -   23s
     0     0 17757.0000    0   55          - 17757.0000      -     -   24s
     0     0 17757.0000    0   58          - 17757.0000      -     -   25s
     0     0 17757.0000    0   68          - 17757.0000      -     -   27s
     0     0 17757.0000    0   61          - 17757.0000      -     -   27s
     0     0 17757.0000    0   16          - 17757.0000      -     -   30s
     0     0 17757.0000    0   29          - 17757.0000      -     -   30s
     0     0 17757.0000    0   40          - 17757.0000      -     -   33s
     0     0 17757.0000    0   34          - 17757.0000      -     -   33s
     0     0 17757.0000    0   66          - 17757.0000      -     -   36s
     0     0 17757.0000    0   58          - 17757.0000      -     -   36s
     0     0 17757.0000    0   57          - 17757.0000      -     -   40s
     0     0 17757.0000    0   45          - 17757.0000      -     -   42s
     0     2 17757.0000    0   45          - 17757.0000      -     -   53s
     7    16 17757.0000    3   53          - 17757.0000      -   371   55s
   611   412 infeasible   20               - 17757.0000      -   133   60s
  1421   736 infeasible   18               - 17757.0000      -   115   65s
  2528  1011 17277.5625   12   39          - 17751.0000      -  99.2   71s
  3244  1226 15933.0000   13   60          - 17654.2683      -   103   75s
  4496  1659 17572.6337   13   98          - 17615.0000      -   105   80s
  5352  1929 17614.2470   15  106          - 17615.0000      -   108   85s
  5798  1996 16781.0000   18  131          - 17615.0000      -   109  100s
  5800  1998 15421.0000   20   31          - 17615.0000      -   109  105s
  5805  2001 17281.0000   24   40          - 17615.0000      -   109  110s
  5810  2004 15427.0000   25   61          - 17615.0000      -   109  115s
  5815  2008 17417.3886   29   31          - 17615.0000      -   109  120s
  5818  2010 16305.0000   16   19          - 17615.0000      -   109  137s
  5819  2010 16633.0000   19   19          - 17615.0000      -   109  147s
  5820  2014 17615.0000   14   21          - 17615.0000      -   3.6  150s
  5834  2037 17615.0000   17   23          - 17615.0000      -   3.9  155s
  5914  2101 17615.0000   20   25          - 17615.0000      -  10.4  162s
  5984  2121 17615.0000   21   61          - 17615.0000      -  13.9  167s
  6141  2149 17615.0000   22   68          - 17615.0000      -  21.7  170s
  6363  2162 17615.0000   25   59          - 17615.0000      -  28.3  175s
  6569  2168 17615.0000   27   98          - 17615.0000      -  33.5  186s
  6738  2186 17615.0000   28   52          - 17615.0000      -  37.1  191s
  7013  2165 17289.0000   31   36          - 17615.0000      -  44.3  196s
  7271  2164 17615.0000   30   92          - 17615.0000      -  50.1  200s
  7527  2127 infeasible   32               - 17615.0000      -  55.9  209s
  7618  2122 17615.0000   29  105          - 17615.0000      -  57.9  211s
  7901  2052 infeasible   31               - 17615.0000      -  65.2  215s
  8173  2061 infeasible   34               - 17615.0000      -  72.1  221s
  8502  2023 12975.0000   37   33          - 17615.0000      -  79.3  228s
  8623  2040 infeasible   38               - 17615.0000      -  82.0  231s
  8938  2039 17615.0000   30  112          - 17615.0000      -  87.8  238s
  9134  2012 17615.0000   31   63          - 17615.0000      -  91.6  241s
  9333  2028 infeasible   40               - 17615.0000      -  95.5  246s
  9498  2015 infeasible   44               - 17615.0000      -  99.0  250s
  9682  1966 16388.9652   21   96          - 17615.0000      -   103  261s
 10096  1953 infeasible   25               - 17615.0000      -   109  266s
 10693  1887 infeasible   33               - 17615.0000      -   115  272s
 11010  1829 16639.0000   30   58          - 17615.0000      -   118  276s
 11630  1697 17614.6897   29   99          - 17615.0000      -   122  282s
 12029  1685 infeasible   33               - 17615.0000      -   125  285s
 12812  1783 17233.0859   42   71          - 17615.0000      -   129  292s
 13175  1795 infeasible   42               - 17615.0000      -   132  309s
 13396  1854 16639.0000   27   45          - 17615.0000      -   134  314s
 13936  1967 17609.0116   22  150          - 17615.0000      -   135  318s
 14446  2016 17609.0116   23  141          - 17615.0000      -   138  323s
 14859  2050 17216.7258   37  120          - 17615.0000      -   139  327s
 15356  2119 13951.0000   37   49          - 17615.0000      -   141  332s
 15950  2108 infeasible   32               - 17615.0000      -   143  337s
 16449  2157 12695.0000   37   24          - 17615.0000      -   146  343s
 17046  2184 infeasible   36               - 17615.0000      -   148  348s
 17682  2202 infeasible   26               - 17607.9348      -   150  352s
 18281  2284 infeasible   21               - 17585.5877      -   152  357s
 18816  2321 17289.0000   23   35          - 17563.4304      -   153  362s
 19494  2371 16893.2222   34   80          - 17459.1988      -   155  367s
 20261  2425 17331.6907   25  146          - 17423.0000      -   157  373s
 20989  2448 17248.7578   31  115          - 17423.0000      -   159  378s
 21870  2507 16305.0000   39   61          - 17422.9762      -   160  384s
 22705  2517 infeasible   25               - 17348.1414      -   161  390s
 23483  2490 17000.0000   29   52          - 17280.9419      -   163  396s
 24282  2490 11763.0000   27   66          - 17234.0000      -   164  402s
 25284  2519 13616.9550   29  108          - 17223.5625      -   165  422s
 25652  2454 13616.6065   32  113          - 17223.5625      -   165  430s
 26874  2370 infeasible   33               - 17146.9616      -   165  436s
 27922  2363 12975.0000   35   44          - 16766.0000      -   167  444s
 28882  2312 infeasible   43               - 16639.0000      -   169  454s
 29688  2252 14919.0000   37   51          - 16639.0000      -   173  463s
 30727  2095 infeasible   41               - 16639.0000      -   175  475s
 31793  2064 13291.0000   31   24          - 16305.0000      -   177  485s
 33046  1875 infeasible   40               - 16305.0000      -   179  495s
 34171  1811 infeasible   26               - 16171.0000      -   180  505s
 35370  1771 infeasible   35               - 15487.9921      -   182  515s
 36568  1710 12867.0000   21   54          - 15487.9865      -   184  528s
 37738  1699 9180.12500   28   64          - 15034.5610      -   186  540s
 39185  1628 13625.0000   30   50          - 13951.0000      -   188  553s
 40789  1629 infeasible   28               - 13617.0000      -   188  566s
 42746  1569 12241.5174   27   46          - 13483.0000      -   188  582s
 44575  1223 11318.2062   42   59          - 13333.0000      -   188  597s
 46126  1000 12725.0000   31   49          - 13005.0000      -   189  615s
 47999   584 11981.2569   38   74          - 12399.0000      -   190  632s
 49905   254 infeasible   34               - 11897.0000      -   190  648s
 52078   162 7184.81250   40   55          - 10930.0000      -   190  681s
 52425     9 infeasible   35               - 10634.9410      -   190  695s
 53036     0 infeasible   38               - 7621.00000      -   190  701s

Cutting planes:
  Learned: 18
  Gomory: 9
  Lift-and-project: 1
  Cover: 510
  Implied bound: 32
  Projected implied bound: 7
  Clique: 8
  MIR: 121
  Mixing: 4
  StrongCG: 3
  Flow cover: 261
  GUB cover: 4
  Inf proof: 10
  Zero half: 18
  RLT: 60
  Relax-and-lift: 9
  BQP: 8

Explored 53079 nodes (10720152 simplex iterations) in 701.49 seconds (69.35 work units)
Thread count was 32 (of 128 available processors)

Solution count 0
No other solutions better than -1e+100

Model is infeasible
Best objective -, best bound -, gap -
TRYING 18 CLONES
Set parameter WLSAccessID
Set parameter WLSSecret
Set parameter LicenseID to value 2687964
Academic license 2687964 - for non-commercial use only - registered to sa___@iict.buet.ac.bd
Set parameter TimeLimit to value 86400
Gurobi Optimizer version 12.0.3 build v12.0.3rc0 (linux64 - "Rocky Linux 9.6 (Blue Onyx)")

CPU model: AMD EPYC 7702 64-Core Processor, instruction set [SSE2|AVX|AVX2]
Thread count: 128 physical cores, 128 logical processors, using up to 32 threads

Non-default parameters:
TimeLimit  86400

Academic license 2687964 - for non-commercial use only - registered to sa___@iict.buet.ac.bd
Optimize a model with 32343 rows, 2932 columns and 95361 nonzeros
Model fingerprint: 0x50a5312f
Model has 160 quadratic constraints
Variable types: 1592 continuous, 1340 integer (1340 binary)
Coefficient statistics:
  Matrix range     [1e-01, 5e+05]
  QMatrix range    [1e+00, 1e+00]
  QLMatrix range   [2e+01, 2e+01]
  Objective range  [3e+02, 4e+03]
  Bounds range     [1e+00, 1e+00]
  RHS range        [1e+00, 4e+00]
  QRHS range       [2e+01, 2e+01]
Presolve removed 25149 rows and 1863 columns
Presolve time: 3.68s
Presolved: 7246 rows, 1095 columns, 22443 nonzeros
Variable types: 517 continuous, 578 integer (576 binary)

Root simplex log...

Iteration    Objective       Primal Inf.    Dual Inf.      Time
    1352    1.9749749e+04   1.806221e+03   0.000000e+00      5s
    2857    1.9749750e+04   0.000000e+00   0.000000e+00      8s
    2857    1.9749750e+04   0.000000e+00   0.000000e+00      8s

Root relaxation: objective 1.974975e+04, 2857 iterations, 3.85 seconds (0.36 work units)
Total elapsed time = 11.12s (DegenMoves)

    Nodes    |    Current Node    |     Objective Bounds      |     Work
 Expl Unexpl |  Obj  Depth IntInf | Incumbent    BestBd   Gap | It/Node Time

     0     0 19749.7500    0  101          - 19749.7500      -     -   15s
     0     0 18355.5000    0  109          - 18355.5000      -     -   16s
     0     0 17757.0000    0  103          - 17757.0000      -     -   17s
     0     0 17757.0000    0   62          - 17757.0000      -     -   19s
     0     0 17757.0000    0   46          - 17757.0000      -     -   19s
     0     0 17757.0000    0   44          - 17757.0000      -     -   20s
     0     0 17757.0000    0   44          - 17757.0000      -     -   20s
     0     0 17757.0000    0   35          - 17757.0000      -     -   22s
     0     0 17757.0000    0   35          - 17757.0000      -     -   22s
     0     0 17757.0000    0   36          - 17757.0000      -     -   25s
     0     0 17757.0000    0   36          - 17757.0000      -     -   25s
     0     0 17757.0000    0   35          - 17757.0000      -     -   26s
     0     0 17757.0000    0   23          - 17757.0000      -     -   27s
     0     0 17757.0000    0   35          - 17757.0000      -     -   28s
     0     0 17757.0000    0   26          - 17757.0000      -     -   28s
     0     0 17757.0000    0   39          - 17757.0000      -     -   30s
     0     0 17757.0000    0   18          - 17757.0000      -     -   31s
     0     2 17757.0000    0   18          - 17757.0000      -     -   44s
     1     4 17757.0000    1   18          - 17757.0000      -   215   45s
   560   386 17612.5625   13   87          - 17757.0000      -   147   50s
  1756   880 17234.0000   14   50          - 17757.0000      -   104   55s
  3467  1269 infeasible   27               - 17753.2079      -  85.7   60s
  4901  1774 infeasible   19               - 17615.0000      -  90.2   65s
  6152  2131 16639.0000   18   65          - 17615.0000      -  95.9   71s
  6450  2133 15221.0000   16  118          - 17615.0000      -  95.6   85s
  6451  2134 16955.0000   21   42          - 17615.0000      -  95.6   90s
  6453  2135 16603.2813   23   41          - 17615.0000      -  95.6   95s
  6457  2138 17147.0000   13   23          - 17615.0000      -  95.5  102s
  6459  2139 16313.0000   17   56          - 17615.0000      -  95.5  105s
  6463  2142 17615.0000   23   21          - 17615.0000      -  95.4  110s
  6467  2145 16305.0000   19   44          - 17615.0000      -  95.4  115s
  6469  2146 16389.0000   20   54          - 17615.0000      -  95.3  121s
  6470  2147 16639.0000   17   41          - 17615.0000      -  95.3  137s
  6471  2147 16621.2500   21   41          - 17615.0000      -  95.3  146s
  6472  2151 17615.0000   16   37          - 17615.0000      -   5.5  150s
  6502  2180 17615.0000   20   59          - 17615.0000      -   7.8  156s
  6636  2243 17615.0000   23  160          - 17615.0000      -  12.8  160s
  6954  2215 17289.0000   25   37          - 17615.0000      -  20.0  165s
  7260  2170 17289.0000   27   35          - 17615.0000      -  25.9  171s
  7422  2122 infeasible   28               - 17615.0000      -  29.1  176s
  7669  2092 infeasible   31               - 17615.0000      -  33.6  181s
  7853  2058 infeasible   35               - 17615.0000      -  37.2  185s
  8238  2032 17536.9200   31   40          - 17615.0000      -  43.2  190s
  8536  1951 11255.0000   37   42          - 17615.0000      -  47.4  202s
  8790  1930 17584.5000   29   58          - 17615.0000      -  51.2  207s
  8968  1919 16305.0000   30   35          - 17615.0000      -  53.3  210s
  9521  1814 17594.1250   33   66          - 17615.0000      -  60.4  215s
 10219  1678 17281.0000   39   36          - 17615.0000      -  66.6  221s
 10807  1522 infeasible   48               - 17609.5649      -  70.5  227s
 11092  1437 infeasible   36               - 17480.4008      -  71.8  230s
 11923  1274 13759.0000   28   53          - 17423.0000      -  77.4  237s
 12223  1189 12783.0000   33   35          - 17423.0000      -  79.3  251s
 12869  1011 infeasible   35               - 17289.0000      -  83.0  255s
 14061  1029 17146.6169   31   78          - 17234.0000      -  88.1  262s
 14859  1012 17115.3984   34  133          - 17234.0000      -  91.3  268s
 15367   999 12507.0000   36   32          - 17228.8217      -  92.7  271s
 15944   935 infeasible   45               - 17220.8124      -  94.1  275s
 16439   939 15994.9281   40  108          - 16639.0000      -  95.7  287s
 16701   916 12975.0000   35   57          - 16639.0000      -  96.5  291s
 17267   893 9817.00000   22   52          - 16639.0000      -  98.3  295s
 18453   888 13619.7813   34   60          - 15807.3658      -   102  304s
 18783   953 14093.0000   34   48          - 14093.0000      -   104  307s
 19272   939 14081.8571   40   83          - 14093.0000      -   107  311s
 19703   928 infeasible   28               - 14093.0000      -   110  315s
 20199   914 infeasible   34               - 14093.0000      -   112  321s
 20731   945 13570.0000   36   82          - 14093.0000      -   115  325s
 21398   964 infeasible   36               - 14058.5226      -   116  330s
 22624   967 13339.0000   30   31          - 13951.0000      -   120  339s
 23397   922 12363.0000   28   37          - 13951.0000      -   122  344s
 24103   968 13291.5977   31  124          - 13333.0000      -   124  350s
 25007   910 infeasible   33               - 13333.0000      -   125  356s
 25870   884 infeasible   33               - 12975.0000      -   126  371s
 26266   854 11982.0000   36   35          - 12975.0000      -   126  376s
 27374   684 infeasible   41               - 12975.0000      -   128  382s
 28162   613 infeasible   41               - 12594.0000      -   129  390s
 29408   510 11682.0000   45   20          - 11897.0000      -   130  398s
 30665   326 9331.85000   36   73          - 11398.0000      -   131  407s
 31685   229 infeasible   42               - 9675.00000      -   132  414s
 32852    29 infeasible   36               - 9675.00000      -   133  424s
 33613     0 infeasible   39               - 9206.21045      -   134  427s

Cutting planes:
  Learned: 11
  Gomory: 9
  Lift-and-project: 5
  Cover: 309
  Implied bound: 13
  Projected implied bound: 1
  MIR: 83
  Mixing: 2
  StrongCG: 1
  Flow cover: 181
  GUB cover: 2
  Inf proof: 11
  Zero half: 15
  RLT: 65
  Relax-and-lift: 11
  BQP: 17
  PSD: 2

Explored 33761 nodes (5169235 simplex iterations) in 427.10 seconds (42.49 work units)
Thread count was 32 (of 128 available processors)

Solution count 0
No other solutions better than -1e+100

Model is infeasible
Best objective -, best bound -, gap -
TRYING 17 CLONES
Set parameter WLSAccessID
Set parameter WLSSecret
Set parameter LicenseID to value 2687964
Academic license 2687964 - for non-commercial use only - registered to sa___@iict.buet.ac.bd
Set parameter TimeLimit to value 86400
Gurobi Optimizer version 12.0.3 build v12.0.3rc0 (linux64 - "Rocky Linux 9.6 (Blue Onyx)")

CPU model: AMD EPYC 7702 64-Core Processor, instruction set [SSE2|AVX|AVX2]
Thread count: 128 physical cores, 128 logical processors, using up to 32 threads

Non-default parameters:
TimeLimit  86400

Academic license 2687964 - for non-commercial use only - registered to sa___@iict.buet.ac.bd
Optimize a model with 30942 rows, 2828 columns and 91197 nonzeros
Model fingerprint: 0x35170af3
Model has 160 quadratic constraints
Variable types: 1508 continuous, 1320 integer (1320 binary)
Coefficient statistics:
  Matrix range     [1e-01, 5e+05]
  QMatrix range    [1e+00, 1e+00]
  QLMatrix range   [2e+01, 2e+01]
  Objective range  [3e+02, 4e+03]
  Bounds range     [1e+00, 1e+00]
  RHS range        [1e+00, 4e+00]
  QRHS range       [2e+01, 2e+01]
Presolve removed 24148 rows and 1805 columns
Presolve time: 3.49s
Presolved: 6842 rows, 1047 columns, 21178 nonzeros
Variable types: 487 continuous, 560 integer (558 binary)

Root simplex log...

Iteration    Objective       Primal Inf.    Dual Inf.      Time
    1631    1.9749749e+04   1.480982e+03   0.000000e+00      5s
    2112    1.9749750e+04   0.000000e+00   0.000000e+00      6s
    2112    1.9749750e+04   0.000000e+00   0.000000e+00      6s

Root relaxation: objective 1.974975e+04, 2112 iterations, 1.92 seconds (0.22 work units)
Total elapsed time = 10.24s (DegenMoves)

    Nodes    |    Current Node    |     Objective Bounds      |     Work
 Expl Unexpl |  Obj  Depth IntInf | Incumbent    BestBd   Gap | It/Node Time

     0     0 19749.7500    0  137          - 19749.7500      -     -   13s
     0     0 18355.5000    0  123          - 18355.5000      -     -   15s
     0     0 17757.0000    0   75          - 17757.0000      -     -   17s
     0     0 17757.0000    0   48          - 17757.0000      -     -   17s
     0     0 17757.0000    0   37          - 17757.0000      -     -   18s
     0     0 17757.0000    0   38          - 17757.0000      -     -   18s
     0     0 17757.0000    0   28          - 17757.0000      -     -   19s
     0     0 17757.0000    0   26          - 17757.0000      -     -   20s
     0     0 17757.0000    0   20          - 17757.0000      -     -   20s
     0     0 17757.0000    0   28          - 17757.0000      -     -   21s
     0     0 17757.0000    0   18          - 17757.0000      -     -   21s
     0     0 17757.0000    0   15          - 17757.0000      -     -   21s
     0     0 17757.0000    0   19          - 17757.0000      -     -   22s
     0     0 17757.0000    0   21          - 17757.0000      -     -   22s
     0     0 17757.0000    0   22          - 17757.0000      -     -   23s
     0     0 17757.0000    0   21          - 17757.0000      -     -   23s
     0     0 17757.0000    0   21          - 17757.0000      -     -   23s
     0     0 17757.0000    0   21          - 17757.0000      -     -   25s
     0     2 17757.0000    0   21          - 17757.0000      -     -   34s
     3     8 17756.9940    2   70          - 17757.0000      -   360   35s
   578   313 11891.0000   13   46          - 17757.0000      -   117   40s
  1504   471 17450.8418   12   83          - 17757.0000      -  94.7   45s
  2882   799 17615.0000   18   35          - 17748.5404      -  84.2   50s
  4530  1169 infeasible   25               - 17615.0000      -  81.8   55s
  5823  1282 17611.3030   20   59          - 17615.0000      -  80.0   60s
  7941  1560 16171.0000   23   22          - 17615.0000      -  76.2   65s
  8797  1652 16354.0000   16  174          - 17615.0000      -  74.7   77s
  8799  1654 14704.0000   22   49          - 17615.0000      -  74.7   80s
  8803  1656 15354.0000   17   57          - 17615.0000      -  74.6   85s
  8806  1658 16889.1828   13   62          - 17615.0000      -  74.6   93s
  8808  1660 16852.0000   17   17          - 17615.0000      -  74.6   95s
  8812  1662 17250.6185   12   70          - 17615.0000      -  74.6  102s
  8815  1664 16508.3118   22   49          - 17615.0000      -  74.5  105s
  8817  1666 17234.0000   14   38          - 17615.0000      -  74.5  123s
  8818  1666 15827.2813   19   38          - 17615.0000      -  74.5  130s
  8825  1679 17615.0000   13    9          - 17615.0000      -   3.2  135s
  8961  1754 infeasible   18               - 17615.0000      -   6.8  140s
  9305  1755 15895.0000   23   34          - 17615.0000      -  13.3  145s
  9753  1660 infeasible   24               - 17615.0000      -  19.8  150s
  9971  1589 17289.0000   22   22          - 17615.0000      -  22.2  155s
 10427  1448 17615.0000   21   45          - 17615.0000      -  28.2  161s
 10809  1381 17615.0000   24   30          - 17615.0000      -  33.5  165s
 10958  1356 17604.5392   30  108          - 17615.0000      -  35.3  172s
 11241  1321 infeasible   32               - 17615.0000      -  38.7  175s
 12106  1117 13616.6536   42   93          - 17615.0000      -  49.0  180s
 12397  1035 17614.7165   33   74          - 17615.0000      -  52.9  185s
 12806   940 infeasible   36               - 17615.0000      -  57.8  190s
 13034   848 infeasible   42               - 17615.0000      -  59.9  196s
 13736   731 15895.0000   30   40          - 17614.6076      -  65.4  202s
 14121   735 15728.0000   39   53          - 17585.6367      -  66.9  205s
 15151   889 15093.0000   22   33          - 17288.7065      -  72.9  211s
 15906   929 17141.7813   25   66          - 17234.0000      -  76.1  216s
 16756   989 infeasible   28               - 17234.0000      -  79.9  222s
 17133  1017 14683.0000   24   35          - 17147.0000      -  81.8  226s
 18060  1080 12000.5969   25   38          - 16975.4286      -  85.5  236s
 18918   984 11602.0000   28   36          - 16786.5000      -  88.5  241s
 19961  1011 12398.0009   26   60          - 16490.5342      -  91.7  247s
 20490  1037 13951.0000   25   42          - 16009.9972      -  93.6  251s
 21018  1074 13737.5000   28   47          - 15424.9697      -  95.9  255s
 22141  1088 infeasible   30               - 14093.0000      -   100  263s
 22736  1086 infeasible   35               - 14093.0000      -   103  267s
 23139  1019 13617.0000   25   42          - 14093.0000      -   105  273s
 23828   986 12641.0000   26   25          - 14093.0000      -   107  278s
 24622   989 infeasible   35               - 13759.0000      -   109  285s
 25607   877 infeasible   23               - 13617.0000      -   110  290s
 26537   851 infeasible   24               - 13236.0000      -   111  296s
 27664   786 infeasible   26               - 12958.0000      -   112  301s
 28585   655 11763.0000   28   44          - 12867.0000      -   112  307s
 29577   571 infeasible   34               - 12231.0000      -   114  314s
 30484   571 11866.0289   35   52          - 11897.0000      -   114  315s
 30796   539 11869.1143   36   63          - 11897.0000      -   115  328s
 31081   325 infeasible   38               - 11897.0000      -   115  335s
 32284   181 infeasible   39               - 11897.0000      -   116  343s
 33641    15 infeasible   26               - 9675.00000      -   116  348s

Cutting planes:
  Learned: 6
  Gomory: 9
  Lift-and-project: 5
  Cover: 216
  Implied bound: 25
  Projected implied bound: 1
  Clique: 3
  MIR: 81
  StrongCG: 1
  Flow cover: 183
  GUB cover: 1
  Inf proof: 5
  Zero half: 27
  RLT: 49
  Relax-and-lift: 20
  BQP: 16
  PSD: 1

Explored 34436 nodes (4660949 simplex iterations) in 349.71 seconds (34.15 work units)
Thread count was 32 (of 128 available processors)

Solution count 0
No other solutions better than -1e+100

Model is infeasible
Best objective -, best bound -, gap -
TRYING 16 CLONES
Set parameter WLSAccessID
Set parameter WLSSecret
Set parameter LicenseID to value 2687964
Academic license 2687964 - for non-commercial use only - registered to sa___@iict.buet.ac.bd
Set parameter TimeLimit to value 86400
Gurobi Optimizer version 12.0.3 build v12.0.3rc0 (linux64 - "Rocky Linux 9.6 (Blue Onyx)")

CPU model: AMD EPYC 7702 64-Core Processor, instruction set [SSE2|AVX|AVX2]
Thread count: 128 physical cores, 128 logical processors, using up to 32 threads

Non-default parameters:
TimeLimit  86400

Academic license 2687964 - for non-commercial use only - registered to sa___@iict.buet.ac.bd
Optimize a model with 29541 rows, 2724 columns and 87033 nonzeros
Model fingerprint: 0xce5e0742
Model has 160 quadratic constraints
Variable types: 1424 continuous, 1300 integer (1300 binary)
Coefficient statistics:
  Matrix range     [1e-01, 5e+05]
  QMatrix range    [1e+00, 1e+00]
  QLMatrix range   [2e+01, 2e+01]
  Objective range  [3e+02, 4e+03]
  Bounds range     [1e+00, 1e+00]
  RHS range        [1e+00, 4e+00]
  QRHS range       [2e+01, 2e+01]
Presolve removed 23155 rows and 1769 columns (presolve time = 5s)...
Presolve removed 23095 rows and 1740 columns
Presolve time: 5.83s
Presolved: 6504 rows, 1013 columns, 20077 nonzeros
Variable types: 457 continuous, 556 integer (554 binary)

Root simplex log...

Iteration    Objective       Primal Inf.    Dual Inf.      Time
       0    2.1472000e+04   2.257162e+02   0.000000e+00      6s
    1983    1.9749750e+04   0.000000e+00   0.000000e+00      8s
    1983    1.9749750e+04   0.000000e+00   0.000000e+00      8s

Root relaxation: objective 1.974975e+04, 1983 iterations, 1.79 seconds (0.18 work units)
Total elapsed time = 10.06s (DegenMoves)

    Nodes    |    Current Node    |     Objective Bounds      |     Work
 Expl Unexpl |  Obj  Depth IntInf | Incumbent    BestBd   Gap | It/Node Time

     0     0 19749.7500    0  135          - 19749.7500      -     -   11s
     0     0 18355.5000    0   99          - 18355.5000      -     -   14s
     0     0 17757.0000    0   95          - 17757.0000      -     -   15s
     0     0 17757.0000    0   52          - 17757.0000      -     -   17s
     0     0 17757.0000    0   37          - 17757.0000      -     -   17s
     0     0 17757.0000    0   31          - 17757.0000      -     -   18s
     0     0 17757.0000    0   42          - 17757.0000      -     -   18s
     0     0 17757.0000    0   25          - 17757.0000      -     -   19s
     0     0 17757.0000    0   18          - 17757.0000      -     -   19s
     0     0 17757.0000    0   11          - 17757.0000      -     -   20s
     0     0 17757.0000    0   26          - 17757.0000      -     -   20s
     0     0 17757.0000    0   18          - 17757.0000      -     -   21s
     0     0 17757.0000    0   15          - 17757.0000      -     -   21s
     0     0 17757.0000    0   30          - 17757.0000      -     -   22s
     0     0 17757.0000    0   22          - 17757.0000      -     -   23s
     0     0 17757.0000    0   10          - 17757.0000      -     -   24s
     0     0 17757.0000    0   18          - 17757.0000      -     -   25s
     0     0 17757.0000    0   19          - 17757.0000      -     -   27s
     0     0 17757.0000    0   19          - 17757.0000      -     -   29s
     0     2 17757.0000    0   19          - 17757.0000      -     -   40s
   180   206 17755.8326    8  111          - 17757.0000      -   200   45s
   715   501 12400.0000   18   23          - 17757.0000      -   130   50s
  1433   815 17289.0000   14   19          - 17757.0000      -   113   56s
  2452  1060 17757.0000   13   34          - 17757.0000      -  96.7   60s
  3383  1342 infeasible   21               - 17757.0000      -  90.0   65s
  5027  1620 infeasible   20               - 17756.9971      -  84.3   70s
  6508  1929 16639.0000   21   19          - 17615.0000      -  86.5   76s
  6510  1930 17537.7109   26   60          - 17615.0000      -  86.4   81s
  6514  1933 15406.0000   24   43          - 17615.0000      -  86.4   85s
  6517  1935 17523.8501   25   49          - 17615.0000      -  86.3   90s
  6521  1938 17615.0000    8    9          - 17615.0000      -  86.3   95s
  6525  1940 16864.6845   24   14          - 17615.0000      -  86.2  101s
  6529  1943 16781.0000   20   37          - 17615.0000      -  86.2  107s
  6530  1944 17234.0000   11   24          - 17615.0000      -  86.2  123s
  6531  1944 16171.0000   26   24          - 17615.0000      -  86.2  129s
  6532  1948 17615.0000   15   28          - 17615.0000      -   3.5  130s
  6682  2087 17615.0000   22   63          - 17615.0000      -   7.6  135s
  7170  2068 17615.0000   27   27          - 17615.0000      -  17.4  140s
  7606  2001 infeasible   35               - 17615.0000      -  27.5  145s
  7911  1967 17614.8798   32  105          - 17615.0000      -  32.8  150s
  8428  1935 infeasible   28               - 17615.0000      -  40.7  156s
  8876  1830 17423.0000   24   10          - 17615.0000      -  46.1  160s
  9413  1722 17288.9991   28   35          - 17615.0000      -  51.2  165s
 10072  1606 infeasible   27               - 17615.0000      -  56.2  170s
 10657  1557 13759.0000   32   48          - 17615.0000      -  61.7  175s
 11446  1359 infeasible   33               - 17615.0000      -  67.6  181s
 11874  1269 9675.00000   31   37          - 17615.0000      -  71.5  188s
 12048  1259 9675.00000   32   41          - 17607.3649      -  72.5  190s
 12746  1207 infeasible   37               - 17515.0710      -  75.7  195s
 13584  1304 14963.2505   33   71          - 17289.0000      -  78.5  201s
 14518  1406 infeasible   30               - 17242.6250      -  81.2  206s
 15335  1397 16977.0000   30   37          - 17147.0000      -  83.8  211s
 16394  1453 infeasible   44               - 16977.0000      -  86.4  215s
 17458  1527 infeasible   28               - 16756.4219      -  89.1  232s
 17914  1584 15679.8167   28   85          - 16197.0723      -  89.7  236s
 18410  1662 infeasible   30               - 16055.0000      -  91.2  241s
 19357  1776 15259.8462   27   73          - 15822.0000      -  93.7  247s
 19949  1780 11573.0000   32   32          - 15813.8532      -  95.4  250s
 21229  1936 infeasible   39               - 15680.0000      -  98.1  259s
 22033  1859 infeasible   35               - 15532.0000      -  98.9  264s
 22766  1886 14073.0000   35   22          - 15532.0000      -   100  270s
 23614  1861 14825.6176   33   55          - 15532.0000      -   101  283s
 23965  1839 14193.0000   37   23          - 15528.7817      -   101  287s
 24770  1843 13927.0000   27   45          - 15151.0000      -   102  291s
 25614  1889 13910.2638   31   82          - 14799.1938      -   103  296s
 26308  1954 infeasible   37               - 14497.0000      -   106  301s
 27010  1992 10424.0000   34   30          - 14128.0000      -   108  307s
 27680  2007 10296.0000   30   30          - 14093.0000      -   111  312s
 28393  1977 infeasible   37               - 14093.0000      -   114  317s
 29085  1954 13951.0000   36   37          - 14093.0000      -   116  323s
 29900  1894 infeasible   44               - 14092.9913      -   118  331s
 30970  1879 infeasible   38               - 13885.1231      -   120  337s
 32272  1850 9349.00000   28   40          - 13766.2066      -   121  346s
 33624  1683 infeasible   48               - 13570.0000      -   122  351s
 35026  1506 12776.5000   30   45          - 13312.8505      -   122  356s
 36504  1455 infeasible   37               - 13102.0000      -   123  365s
 37735  1395 infeasible   31               - 12768.0000      -   124  374s
 38799  1321 infeasible   35               - 12640.8695      -   126  381s
 39830  1269 11994.6680   30   92          - 12158.0000      -   128  389s
 41210  1271 infeasible   36               - 12016.0000      -   130  412s
 41471  1083 10659.0000   30   22          - 12014.5117      -   130  421s
 43108   864 11153.0000   38   24          - 11633.8123      -   131  428s
 44758   724 8853.00000   36   11          - 11203.3231      -   132  435s
 46686   471 infeasible   38               - 10930.0000      -   133  441s
 48521   204 9675.00000   35   39          - 10892.0000      -   133  449s
 50408    61 infeasible   34               - 9294.00000      -   133  459s
 51413     0 infeasible   36               - 7406.00000      -   133  462s

Cutting planes:
  Learned: 18
  Gomory: 14
  Lift-and-project: 1
  Cover: 386
  Implied bound: 20
  Clique: 1
  MIR: 102
  Mixing: 1
  StrongCG: 2
  Flow cover: 238
  GUB cover: 2
  Inf proof: 10
  Zero half: 29
  RLT: 55
  Relax-and-lift: 4
  BQP: 1
  PSD: 1

Explored 51676 nodes (7453158 simplex iterations) in 462.91 seconds (45.05 work units)
Thread count was 32 (of 128 available processors)

Solution count 0
No other solutions better than -1e+100

Model is infeasible
Best objective -, best bound -, gap -
TRYING 15 CLONES
Set parameter WLSAccessID
Set parameter WLSSecret
Set parameter LicenseID to value 2687964
Academic license 2687964 - for non-commercial use only - registered to sa___@iict.buet.ac.bd
Set parameter TimeLimit to value 86400
Gurobi Optimizer version 12.0.3 build v12.0.3rc0 (linux64 - "Rocky Linux 9.6 (Blue Onyx)")

CPU model: AMD EPYC 7702 64-Core Processor, instruction set [SSE2|AVX|AVX2]
Thread count: 128 physical cores, 128 logical processors, using up to 32 threads

Non-default parameters:
TimeLimit  86400

Academic license 2687964 - for non-commercial use only - registered to sa___@iict.buet.ac.bd
Optimize a model with 28140 rows, 2620 columns and 82869 nonzeros
Model fingerprint: 0xf9fb446e
Model has 160 quadratic constraints
Variable types: 1340 continuous, 1280 integer (1280 binary)
Coefficient statistics:
  Matrix range     [1e-01, 5e+05]
  QMatrix range    [1e+00, 1e+00]
  QLMatrix range   [2e+01, 2e+01]
  Objective range  [3e+02, 4e+03]
  Bounds range     [1e+00, 1e+00]
  RHS range        [1e+00, 4e+00]
  QRHS range       [2e+01, 2e+01]
Presolve removed 22126 rows and 1681 columns
Presolve time: 1.04s
Presolved: 6070 rows, 967 columns, 18741 nonzeros
Variable types: 427 continuous, 540 integer (538 binary)

Root relaxation: objective 1.974975e+04, 2156 iterations, 0.77 seconds (0.21 work units)

    Nodes    |    Current Node    |     Objective Bounds      |     Work
 Expl Unexpl |  Obj  Depth IntInf | Incumbent    BestBd   Gap | It/Node Time

     0     0 19749.7500    0  110          - 19749.7500      -     -    3s
     0     0 18355.5000    0   91          - 18355.5000      -     -    4s
     0     0 17757.0000    0   82          - 17757.0000      -     -    4s
     0     0 17757.0000    0   72          - 17757.0000      -     -    5s
     0     0 17757.0000    0   46          - 17757.0000      -     -    5s
     0     0 17757.0000    0   76          - 17757.0000      -     -    5s
     0     0 17757.0000    0   67          - 17757.0000      -     -    6s
     0     0 17757.0000    0   23          - 17757.0000      -     -    7s
     0     0 17757.0000    0   33          - 17757.0000      -     -    7s
     0     0 17757.0000    0   17          - 17757.0000      -     -    8s
     0     0 17757.0000    0   15          - 17757.0000      -     -    8s
     0     0 17757.0000    0   23          - 17757.0000      -     -    9s
     0     0 17757.0000    0   23          - 17757.0000      -     -    9s
     0     0 17757.0000    0   18          - 17757.0000      -     -    9s
     0     0 17757.0000    0   20          - 17757.0000      -     -    9s
     0     0 17757.0000    0   28          - 17757.0000      -     -   10s
     0     0 17757.0000    0   20          - 17757.0000      -     -   11s
     0     2 17757.0000    0   20          - 17757.0000      -     -   17s
   580   336 17641.4047    7   67          - 17757.0000      -   120   20s
  2755   847 infeasible   16               - 17756.9860      -  93.6   25s
  4639  1362 17614.1572    9   69          - 17672.4483      -  95.7   30s
  6598  1829 17580.7689   22  101          - 17615.0000      -  96.0   35s
  7327  1936 17234.0000   23  101          - 17615.0000      -  94.3   44s
  7328  1937 14093.0000   20   51          - 17615.0000      -  94.3   45s
  7331  1939 17320.0000   18   57          - 17615.0000      -  94.2   50s
  7338  1944 14093.0000   21   24          - 17615.0000      -  94.1   55s
  7344  1948 17141.3533   12   24          - 17615.0000      -  94.1   60s
  7347  1950 16447.0000   25   25          - 17615.0000      -  94.0   72s
  7348  1950 13045.7930   20   25          - 17615.0000      -  94.0   75s
  7411  2015 17615.0000   15   34          - 17615.0000      -   5.3   80s
  7776  2099 17601.5625   22   34          - 17615.0000      -  13.9   85s
  8289  2021 17141.7813   23   51          - 17615.0000      -  23.3   94s
  8361  2024 17233.5430   22   59          - 17615.0000      -  24.5   95s
  9323  1753 17289.0000   19   24          - 17615.0000      -  35.4  100s
  9958  1704 16639.0000   20   51          - 17615.0000      -  42.6  105s
 10985  1578 infeasible   30               - 17615.0000      -  53.1  111s
 11630  1482 17610.8781   22   67          - 17615.0000      -  58.4  115s
 12302  1349 16900.0000   31   16          - 17615.0000      -  63.6  120s
 12881  1213 16662.0778   21  101          - 17615.0000      -  67.4  126s
 13892  1159 infeasible   32               - 17606.5997      -  73.0  132s
 14646  1173 infeasible   19               - 17551.7969      -  75.1  135s
 15943  1218 infeasible   27               - 17234.0000      -  80.0  140s
 17079  1246 16258.0000   27   20          - 17234.0000      -  82.7  149s
 17345  1233 infeasible   30               - 17234.0000      -  83.5  151s
 18390  1132 13149.0000   26   21          - 17017.5979      -  86.1  156s
 19719  1055 11280.9990   33   24          - 16393.6667      -  88.4  161s
 20501   994 15372.0000   24   21          - 16050.8091      -  89.2  165s
 22005  1029 infeasible   26               - 15532.0000      -  91.1  173s
 22692  1060 14092.4201   24   46          - 15531.9886      -  91.5  175s
 24134  1021 infeasible   29               - 14320.5969      -  94.5  181s
 24665  1072 infeasible   23               - 14093.0000      -  96.7  187s
 25297  1038 13911.1065   26  133          - 14093.0000      -  98.6  191s
 26016  1054 12975.0000   26   43          - 13897.4333      -   100  196s
 26849  1036 infeasible   25               - 13867.5000      -   102  207s
 27119   999 infeasible   24               - 13867.5000      -   103  212s
 28028   955 8443.00000   28   17          - 13617.0000      -   104  216s
 28802   898 infeasible   31               - 13616.9884      -   106  220s
 30842   575 infeasible   29               - 12975.0000      -   109  229s
 31814   575 infeasible   33               - 12594.0000      -   110  230s
 33306    62 infeasible   30               - 11891.0000      -   111  239s
 34222    14 9669.00000   33   31          - 10079.5725      -   112  242s

Cutting planes:
  Learned: 9
  Gomory: 16
  Cover: 248
  Implied bound: 19
  MIR: 57
  StrongCG: 2
  Flow cover: 154
  Inf proof: 3
  Zero half: 28
  RLT: 54
  Relax-and-lift: 19
  BQP: 9

Explored 34586 nodes (4574366 simplex iterations) in 244.61 seconds (30.34 work units)
Thread count was 32 (of 128 available processors)

Solution count 0
No other solutions better than -1e+100

Model is infeasible
Best objective -, best bound -, gap -
TRYING 14 CLONES
Set parameter WLSAccessID
Set parameter WLSSecret
Set parameter LicenseID to value 2687964
Academic license 2687964 - for non-commercial use only - registered to sa___@iict.buet.ac.bd
Set parameter TimeLimit to value 86400
Gurobi Optimizer version 12.0.3 build v12.0.3rc0 (linux64 - "Rocky Linux 9.6 (Blue Onyx)")

CPU model: AMD EPYC 7702 64-Core Processor, instruction set [SSE2|AVX|AVX2]
Thread count: 128 physical cores, 128 logical processors, using up to 32 threads

Non-default parameters:
TimeLimit  86400

Academic license 2687964 - for non-commercial use only - registered to sa___@iict.buet.ac.bd
Optimize a model with 26739 rows, 2516 columns and 78705 nonzeros
Model fingerprint: 0xf047e603
Model has 160 quadratic constraints
Variable types: 1256 continuous, 1260 integer (1260 binary)
Coefficient statistics:
  Matrix range     [1e-01, 5e+05]
  QMatrix range    [1e+00, 1e+00]
  QLMatrix range   [2e+01, 2e+01]
  Objective range  [3e+02, 4e+03]
  Bounds range     [1e+00, 1e+00]
  RHS range        [1e+00, 4e+00]
  QRHS range       [2e+01, 2e+01]
Presolve removed 21133 rows and 1624 columns
Presolve time: 3.05s
Presolved: 5656 rows, 917 columns, 17449 nonzeros
Variable types: 397 continuous, 520 integer (518 binary)

Root relaxation: objective 1.974975e+04, 1878 iterations, 0.96 seconds (0.16 work units)
Total elapsed time = 5.03s (DegenMoves)

    Nodes    |    Current Node    |     Objective Bounds      |     Work
 Expl Unexpl |  Obj  Depth IntInf | Incumbent    BestBd   Gap | It/Node Time

     0     0 19749.7500    0  127          - 19749.7500      -     -    5s
     0     0 18355.5000    0   93          - 18355.5000      -     -    5s
     0     0 17757.0000    0   93          - 17757.0000      -     -    6s
     0     0 17757.0000    0   61          - 17757.0000      -     -    6s
     0     0 17757.0000    0   58          - 17757.0000      -     -    7s
     0     0 17757.0000    0   64          - 17757.0000      -     -    7s
     0     0 17757.0000    0   62          - 17757.0000      -     -    7s
     0     0 17757.0000    0   18          - 17757.0000      -     -    8s
     0     0 17757.0000    0   22          - 17757.0000      -     -    9s
     0     0 17757.0000    0    9          - 17757.0000      -     -   10s
     0     0 17757.0000    0   16          - 17757.0000      -     -   10s
     0     0 17757.0000    0   17          - 17757.0000      -     -   11s
     0     0 17757.0000    0   17          - 17757.0000      -     -   11s
     0     0 17757.0000    0   10          - 17757.0000      -     -   11s
     0     0 17757.0000    0    8          - 17757.0000      -     -   12s
     0     2 17757.0000    0    8          - 17757.0000      -     -   17s
    93   127 17755.6293    7  146          - 17757.0000      -   207   20s
  1217   560 17413.8904   12  176          - 17757.0000      -   118   25s
  2785   979 17423.0000   17   20          - 17756.9863      -   100   30s
  4471  1384 17614.2179   16   66          - 17640.0000      -  96.5   35s
  5937  1696 17615.0000   10   27          - 17615.0000      -  95.6   40s
  6851  1914 16258.0000   22  101          - 17615.0000      -  94.7   47s
  6853  1916 15675.2211   11   53          - 17615.0000      -  94.7   50s
  6857  1918 17281.0000   17   15          - 17615.0000      -  94.6   55s
  6862  1922 17289.0000    7   11          - 17615.0000      -  94.5   60s
  6870  1927 17613.1719   11   13          - 17615.0000      -  94.4   65s
  6871  1928 16848.8495   13    7          - 17615.0000      -  94.4   75s
  6887  1952 17615.0000   15   21          - 17615.0000      -   3.2   80s
  7260  2031 17289.0000   20   36          - 17615.0000      -  10.3   85s
  8217  1868 infeasible   30               - 17615.0000      -  23.1   90s
  9117  1708 17319.9651   20   64          - 17615.0000      -  33.1   96s
 10105  1571 infeasible   21               - 17615.0000      -  40.1  100s
 11375  1249 infeasible   32               - 17615.0000      -  50.1  105s
 11933  1092 17234.0000   23   17          - 17615.0000      -  53.2  112s
 12726   909 infeasible   29               - 17502.2438      -  57.6  115s
 13726   958 12364.1250   27   50          - 17289.0000      -  62.5  120s
 15320  1040 infeasible   27               - 17234.0000      -  68.1  126s
 16349  1039 12233.0000   36   20          - 17233.7179      -  70.2  132s
 17883   979 14703.9348   28   43          - 16900.0000      -  73.1  135s
 20402  1092 11497.0000   38   29          - 16171.0000      -  77.1  140s
 21905  1034 11154.0000   32   19          - 16171.0000      -  78.9  145s
 24154  1011 infeasible   25               - 14093.0000      -  82.5  152s
 24707  1121 13371.1429   33   58          - 14093.0000      -  83.8  155s
 25420  1166 13617.0000   29   26          - 14093.0000      -  85.3  162s
 26530  1219 infeasible   34               - 14093.0000      -  87.4  167s
 28133  1276 12171.9691   37   55          - 13625.0000      -  90.6  173s
 28890  1242 infeasible   28               - 13594.5200      -  92.0  178s
 29797  1246 infeasible   39               - 13482.8979      -  93.4  183s
 30909  1233 infeasible   32               - 13329.9989      -  94.8  187s
 32008  1090 infeasible   32               - 13236.0000      -  96.2  192s
 33132  1039 12854.0000   30   20          - 12921.1996      -  97.5  197s
 34513   897 10745.0000   31   22          - 12507.0000      -  98.4  201s
 35835   753 infeasible   34               - 12173.0000      -  99.2  206s
 37357   627 infeasible   40               - 11869.0000      -   100  212s
 39030   314 infeasible   34               - 11868.9949      -   100  218s
 40373   104 infeasible   32               - 11812.4317      -   101  224s
 41529    15 infeasible   34               - 9786.00000      -   101  228s

Cutting planes:
  Learned: 5
  Gomory: 8
  Lift-and-project: 1
  Cover: 246
  Implied bound: 16
  MIR: 72
  Mixing: 3
  StrongCG: 3
  Flow cover: 180
  Inf proof: 6
  Zero half: 16
  Mod-K: 1
  RLT: 58
  Relax-and-lift: 15
  BQP: 6
  PSD: 1

Explored 41971 nodes (4918784 simplex iterations) in 228.73 seconds (26.55 work units)
Thread count was 32 (of 128 available processors)

Solution count 0
No other solutions better than -1e+100

Model is infeasible
Best objective -, best bound -, gap -
TRYING 13 CLONES
Set parameter WLSAccessID
Set parameter WLSSecret
Set parameter LicenseID to value 2687964
Academic license 2687964 - for non-commercial use only - registered to sa___@iict.buet.ac.bd
Set parameter TimeLimit to value 86400
Gurobi Optimizer version 12.0.3 build v12.0.3rc0 (linux64 - "Rocky Linux 9.6 (Blue Onyx)")

CPU model: AMD EPYC 7702 64-Core Processor, instruction set [SSE2|AVX|AVX2]
Thread count: 128 physical cores, 128 logical processors, using up to 32 threads

Non-default parameters:
TimeLimit  86400

Academic license 2687964 - for non-commercial use only - registered to sa___@iict.buet.ac.bd
Optimize a model with 25338 rows, 2412 columns and 74541 nonzeros
Model fingerprint: 0x34a42989
Model has 160 quadratic constraints
Variable types: 1172 continuous, 1240 integer (1240 binary)
Coefficient statistics:
  Matrix range     [1e-01, 5e+05]
  QMatrix range    [1e+00, 1e+00]
  QLMatrix range   [2e+01, 2e+01]
  Objective range  [3e+02, 4e+03]
  Bounds range     [1e+00, 1e+00]
  RHS range        [1e+00, 4e+00]
  QRHS range       [2e+01, 2e+01]
Presolve removed 20104 rows and 1562 columns
Presolve time: 1.22s
Presolved: 5288 rows, 877 columns, 16274 nonzeros
Variable types: 367 continuous, 510 integer (508 binary)

Root relaxation: objective 1.974975e+04, 1449 iterations, 0.60 seconds (0.10 work units)

    Nodes    |    Current Node    |     Objective Bounds      |     Work
 Expl Unexpl |  Obj  Depth IntInf | Incumbent    BestBd   Gap | It/Node Time

     0     0 19749.7500    0   96          - 19749.7500      -     -    3s
     0     0 18314.5000    0  106          - 18314.5000      -     -    4s
     0     0 17757.0000    0   99          - 17757.0000      -     -    4s
     0     0 17757.0000    0   58          - 17757.0000      -     -    5s
     0     0 17757.0000    0   44          - 17757.0000      -     -    5s
     0     0 17757.0000    0   48          - 17757.0000      -     -    6s
     0     0 17757.0000    0   48          - 17757.0000      -     -    6s
*    0     0               0    17757.000000 17757.0000  0.00%     -    6s

Cutting planes:
  Learned: 3
  Gomory: 3
  Cover: 15
  Implied bound: 9
  Clique: 4
  MIR: 14
  Flow cover: 17
  Zero half: 10
  RLT: 35
  BQP: 6

Explored 1 nodes (8571 simplex iterations) in 6.51 seconds (1.00 work units)
Thread count was 32 (of 128 available processors)

Solution count 1: 17757 

Optimal solution found (tolerance 1.00e-04)
Best objective 1.775700000000e+04, best bound 1.775700000000e+04, gap 0.0000%
THERE IS A SOLUTION WITH 13 CLONES
THERE IS A SOLUTION WITH 13 CLONES
Set parameter WLSAccessID
Set parameter WLSSecret
Set parameter LicenseID to value 2687964
Academic license 2687964 - for non-commercial use only - registered to sa___@iict.buet.ac.bd
[1. 1. 0. 0. 0. 1. 1. 1. 1. 1. 1. 0. 0. 0. 1. 0. 1. 1. 0. 0.]
Set parameter TimeLimit to value 14400
Gurobi Optimizer version 12.0.3 build v12.0.3rc0 (linux64 - "Rocky Linux 9.6 (Blue Onyx)")

CPU model: AMD EPYC 7702 64-Core Processor, instruction set [SSE2|AVX|AVX2]
Thread count: 128 physical cores, 128 logical processors, using up to 32 threads

Non-default parameters:
TimeLimit  14400

Academic license 2687964 - for non-commercial use only - registered to sa___@iict.buet.ac.bd
Optimize a model with 25358 rows, 2412 columns and 74561 nonzeros
Model fingerprint: 0x61ad970e
Model has 160 quadratic constraints
Variable types: 1172 continuous, 1240 integer (1240 binary)
Coefficient statistics:
  Matrix range     [1e-01, 5e+05]
  QMatrix range    [1e+00, 1e+00]
  QLMatrix range   [2e+01, 2e+01]
  Objective range  [3e+02, 4e+03]
  Bounds range     [1e+00, 1e+00]
  RHS range        [1e+00, 4e+00]
  QRHS range       [2e+01, 2e+01]
Presolve removed 25157 rows and 2328 columns
Presolve time: 0.10s
Presolved: 201 rows, 84 columns, 571 nonzeros
Variable types: 51 continuous, 33 integer (33 binary)

Root relaxation: objective 1.775700e+04, 64 iterations, 0.00 seconds (0.00 work units)

    Nodes    |    Current Node    |     Objective Bounds      |     Work
 Expl Unexpl |  Obj  Depth IntInf | Incumbent    BestBd   Gap | It/Node Time

     0     0 17757.0000    0    2          - 17757.0000      -     -    0s
     0     0 17757.0000    0    5          - 17757.0000      -     -    0s
     0     0 -1.000e+100    0    3          - infeasible      -     -    0s

Cutting planes:
  Gomory: 1
  Cover: 6
  Flow cover: 3
  RLT: 3

Explored 1 nodes (212 simplex iterations) in 0.26 seconds (0.07 work units)
Thread count was 32 (of 128 available processors)

Solution count 0
No other solutions better than -1e+100

Model is infeasible
Best objective -, best bound -, gap -
