clone_id
O    1708
B    1584
D    1246
Q     974
G     415
N     359
E     237
I     184
J     122
M     120
K     105
C      94
A      92
H      64
L      59
P      49
F      33
Name: count, dtype: int64
clone_id
O    0.229416
B    0.212760
D    0.167361
Q    0.130826
G    0.055742
N    0.048220
E    0.031833
I    0.024715
J    0.016387
M    0.016118
K    0.014103
C    0.012626
A    0.012357
H    0.008596
L    0.007925
P    0.006582
F    0.004433
Name: count, dtype: float64
0.018518518518518517
['B', 'D', 'E', 'G', 'I', 'N', 'O', 'Q']
   B  N  O  Q
B  0  0  1  1
N  1  0  1  1
O  1  0  0  1
Q  1  0  1  0
                 0    1      2    3         4  ...   14   15   16   17        18
clone_id                                       ...                              
B         0.782609  1.0  0.625  1.0  0.000000  ...  0.0  1.0  0.5  1.0  0.730769
N         0.000000  0.0  0.000  0.0  0.000000  ...  0.0  0.0  0.0  0.0  0.000000
O         0.000000  1.0  0.000  1.0  1.000000  ...  1.0  0.0  0.0  0.0  1.000000
Q         0.000000  1.0  1.000  0.0  0.666667  ...  1.0  1.0  0.0  0.0  1.000000

[4 rows x 19 columns]
TRYING 20 CLONES
Set parameter WLSAccessID
Set parameter WLSSecret
Set parameter LicenseID to value 2687964
Academic license 2687964 - for non-commercial use only - registered to sa___@iict.buet.ac.bd
Set parameter TimeLimit to value 86400
Gurobi Optimizer version 12.0.3 build v12.0.3rc0 (linux64 - "Rocky Linux 9.6 (Blue Onyx)")

CPU model: AMD EPYC 7702 64-Core Processor, instruction set [SSE2|AVX|AVX2]
Thread count: 128 physical cores, 128 logical processors, using up to 32 threads

Non-default parameters:
TimeLimit  86400

Academic license 2687964 - for non-commercial use only - registered to sa___@iict.buet.ac.bd
Optimize a model with 31945 rows, 2949 columns and 94177 nonzeros
Model fingerprint: 0xa7638dc3
Model has 152 quadratic constraints
Variable types: 1676 continuous, 1273 integer (1273 binary)
Coefficient statistics:
  Matrix range     [2e-01, 3e+05]
  QMatrix range    [1e+00, 1e+00]
  QLMatrix range   [2e+01, 2e+01]
  Objective range  [3e+02, 4e+03]
  Bounds range     [1e+00, 1e+00]
  RHS range        [1e+00, 4e+00]
  QRHS range       [2e+01, 2e+01]
Presolve removed 23961 rows and 1793 columns
Presolve time: 1.94s
Presolved: 8034 rows, 1181 columns, 24923 nonzeros
Variable types: 577 continuous, 604 integer (602 binary)

Root relaxation: objective 2.006700e+04, 2681 iterations, 2.00 seconds (0.34 work units)
Total elapsed time = 6.32s (DegenMoves)
Total elapsed time = 10.88s (DegenMoves)

    Nodes    |    Current Node    |     Objective Bounds      |     Work
 Expl Unexpl |  Obj  Depth IntInf | Incumbent    BestBd   Gap | It/Node Time

     0     0 20067.0000    0   80          - 20067.0000      -     -   12s
     0     0 18296.0000    0  141          - 18296.0000      -     -   16s
     0     0 17964.0000    0  119          - 17964.0000      -     -   17s
     0     0 17964.0000    0   54          - 17964.0000      -     -   19s
     0     0 17964.0000    0   48          - 17964.0000      -     -   20s
     0     0 17964.0000    0   47          - 17964.0000      -     -   21s
     0     0 17964.0000    0   45          - 17964.0000      -     -   21s
     0     0 17964.0000    0   27          - 17964.0000      -     -   23s
     0     0 17964.0000    0   26          - 17964.0000      -     -   23s
     0     0 17964.0000    0   52          - 17964.0000      -     -   25s
     0     0 17964.0000    0   45          - 17964.0000      -     -   26s
     0     0 17964.0000    0   48          - 17964.0000      -     -   28s
     0     0 17964.0000    0   61          - 17964.0000      -     -   28s
     0     0 17964.0000    0   61          - 17964.0000      -     -   31s
     0     0 17964.0000    0   60          - 17964.0000      -     -   32s
     0     0 17964.0000    0   29          - 17964.0000      -     -   33s
     0     0 17964.0000    0   35          - 17964.0000      -     -   34s
     0     0 17964.0000    0   44          - 17964.0000      -     -   36s
     0     0 17964.0000    0   22          - 17964.0000      -     -   38s
     0     2 17964.0000    0   22          - 17964.0000      -     -   52s
    15    32 17963.6865    4  113          - 17964.0000      -   276   55s
   251   238 13619.0126   11  150          - 17964.0000      -   224   60s
   602   420 17963.1953   11  114          - 17964.0000      -   152   65s
  1211   635 17489.2222   17   57          - 17964.0000      -   131   70s
  1778   815 infeasible   10               - 17964.0000      -   131   75s
  2041   860 infeasible   18               - 17964.0000      -   130   80s
  2557  1051 17631.0000   10   30          - 17964.0000      -   130   86s
  3054  1186 infeasible   20               - 17964.0000      -   128   90s
  3754  1327 infeasible   20               - 17964.0000      -   127   95s
  4494  1391 13681.9811    9  100          - 17964.0000      -   123  100s
  5132  1460 16906.5417   22   72          - 17964.0000      -   118  105s
  6018  1601 15557.0859   15  104          - 17959.0000      -   115  110s
  7130  1818 15706.4231   14   79          - 17909.0000      -   110  115s
  8629  1900 17441.0000   11   26          - 17909.0000      -   104  121s
  9761  2006 infeasible   18               - 17631.0000      -  99.1  125s
 11679  2185 17496.0000   13   49          - 17496.0000      -  94.0  131s
 12315  2186 17079.8571    9   22          - 17496.0000      -  92.8  144s
 12317  2187 17480.9219   19  168          - 17496.0000      -  92.8  160s
 12318  2188 16878.0000   25   46          - 17496.0000      -  92.8  165s
 12321  2190 16207.9246   23   51          - 17496.0000      -  92.8  170s
 12323  2191 13671.6498   18   34          - 17496.0000      -  92.8  175s
 12325  2193 11710.0000   14   48          - 17496.0000      -  92.8  180s
 12328  2195 16151.1055   12   40          - 17496.0000      -  92.7  185s
 12332  2197 16520.0000   17   49          - 17496.0000      -  92.7  195s
 12333  2198 16916.4219   19   49          - 17496.0000      -  92.7  219s
 12334  2199 6012.02651   16   49          - 17496.0000      -  92.7  235s
 12337  2204 17496.0000   12   16          - 17496.0000      -   1.7  240s
 12415  2273 17496.0000   17   33          - 17496.0000      -   3.0  246s
 12510  2311 17496.0000   19   45          - 17496.0000      -   5.3  250s
 12721  2339 17496.0000   22   38          - 17496.0000      -   8.2  255s
 12990  2320 17496.0000   25   73          - 17496.0000      -  11.2  260s
 13185  2286 17496.0000   26   52          - 17496.0000      -  14.0  265s
 13414  2248 17496.0000   29   28          - 17496.0000      -  16.8  271s
 13584  2230 infeasible   30               - 17496.0000      -  18.9  275s
 13904  2207 17496.0000   28   81          - 17496.0000      -  23.1  281s
 14138  2175 17034.0000   31   21          - 17496.0000      -  25.7  285s
 14423  2147 17132.5000   35   40          - 17496.0000      -  29.1  299s
 14527  2139 infeasible   39               - 17496.0000      -  30.3  301s
 14933  2066 17496.0000   31   28          - 17496.0000      -  33.8  305s
 15550  1965 17108.6000   32   68          - 17496.0000      -  38.7  312s
 16030  1845 infeasible   32               - 17496.0000      -  42.6  317s
 16265  1804 17496.0000   31   12          - 17496.0000      -  44.7  320s
 16806  1713 infeasible   24               - 17496.0000      -  48.6  325s
 17063  1626 14194.0000   23   72          - 17496.0000      -  50.7  338s
 17263  1615 infeasible   25               - 17496.0000      -  51.9  342s
 17632  1529 17496.0000   30   94          - 17496.0000      -  54.1  345s
 18318  1373 infeasible   26               - 17496.0000      -  57.8  353s
 18681  1295 17496.0000   25  158          - 17496.0000      -  60.1  357s
 19050  1252 12294.0000   28   80          - 17496.0000      -  61.9  360s
 19804  1332 infeasible   36               - 17496.0000      -  66.4  367s
 20175  1380 16398.6250   37   46          - 17496.0000      -  68.5  371s
 20606  1408 infeasible   27               - 17496.0000      -  70.7  375s
 21478  1449 infeasible   27               - 17496.0000      -  74.8  384s
 21858  1488 14014.3200   34   75          - 17496.0000      -  76.2  388s
 22380  1532 infeasible   36               - 17496.0000      -  78.1  420s
 23289  1612 12635.0000   29   54          - 17496.0000      -  80.7  430s
 24547  1624 infeasible   37               - 17441.0000      -  84.6  438s
 25222  1620 17013.0000   38   22          - 17430.2056      -  86.3  443s
 26106  1552 infeasible   40               - 17346.0000      -  87.5  449s
 26960  1503 16932.0000   36   38          - 17334.3000      -  89.0  454s
 27530  1445 infeasible   24               - 17265.0000      -  90.3  461s
 28401  1340 infeasible   25               - 16893.1931      -  91.9  468s
 29070  1289 13377.2451   28   81          - 16878.0000      -  94.1  475s
 29968  1256 infeasible   24               - 16370.0000      -  96.0  483s
 30706  1327 infeasible   38               - 15787.0000      -  97.9  491s
 31382  1383 12294.0000   27   47          - 14792.0000      -   100  502s
 32018  1413 infeasible   30               - 14249.0000      -   103  512s
 32810  1496 infeasible   33               - 14249.0000      -   106  524s
 33718  1477 infeasible   29               - 14249.0000      -   111  536s
 34670  1477 14190.2747   25  109          - 14249.0000      -   115  548s
 35662  1463 13829.9416   29   72          - 14194.0000      -   119  560s
 36774  1498 12500.0000   31   38          - 13861.0000      -   122  572s
 38397  1405 infeasible   41               - 13726.0000      -   124  586s
 40059  1234 12343.0000   33   38          - 13631.0000      -   126  602s
 41321  1240 12968.0000   31   45          - 13550.0000      -   128  644s
 41603  1063 infeasible   43               - 13217.0000      -   129  656s
 43353   884 10769.6667   31   84          - 12690.0000      -   131  670s
 44852   720 infeasible   29               - 12294.0000      -   133  685s
 46806   518 infeasible   27               - 12294.0000      -   134  700s
 48362   326 9135.14453   28   57          - 11233.0000      -   136  713s
 50298    31 infeasible   32               - 9583.77257      -   137  728s
 51843     0 infeasible   35               - 7705.00000      -   138  730s

Cutting planes:
  Learned: 14
  Gomory: 10
  Cover: 417
  Implied bound: 31
  Clique: 1
  MIR: 59
  StrongCG: 2
  Flow cover: 145
  Inf proof: 18
  Zero half: 34
  RLT: 53
  Relax-and-lift: 9
  BQP: 13

Explored 51934 nodes (8318340 simplex iterations) in 730.28 seconds (57.55 work units)
Thread count was 32 (of 128 available processors)

Solution count 0
No other solutions better than -1e+100

Model is infeasible
Best objective -, best bound -, gap -
TRYING 19 CLONES
Set parameter WLSAccessID
Set parameter WLSSecret
Set parameter LicenseID to value 2687964
Academic license 2687964 - for non-commercial use only - registered to sa___@iict.buet.ac.bd
Set parameter TimeLimit to value 86400
Gurobi Optimizer version 12.0.3 build v12.0.3rc0 (linux64 - "Rocky Linux 9.6 (Blue Onyx)")

CPU model: AMD EPYC 7702 64-Core Processor, instruction set [SSE2|AVX|AVX2]
Thread count: 128 physical cores, 128 logical processors, using up to 32 threads

Non-default parameters:
TimeLimit  86400

Academic license 2687964 - for non-commercial use only - registered to sa___@iict.buet.ac.bd
Optimize a model with 30671 rows, 2850 columns and 90392 nonzeros
Model fingerprint: 0x710df04c
Model has 152 quadratic constraints
Variable types: 1596 continuous, 1254 integer (1254 binary)
Coefficient statistics:
  Matrix range     [2e-01, 3e+05]
  QMatrix range    [1e+00, 1e+00]
  QLMatrix range   [2e+01, 2e+01]
  Objective range  [3e+02, 4e+03]
  Bounds range     [1e+00, 1e+00]
  RHS range        [1e+00, 4e+00]
  QRHS range       [2e+01, 2e+01]
Presolve removed 23135 rows and 1765 columns (presolve time = 5s)...
Presolve removed 23061 rows and 1737 columns
Presolve time: 5.38s
Presolved: 7662 rows, 1139 columns, 23738 nonzeros
Variable types: 547 continuous, 592 integer (590 binary)

Root simplex log...

Iteration    Objective       Primal Inf.    Dual Inf.      Time
       0    2.2330000e+04   2.597266e+02   0.000000e+00      6s
    2564    2.0066999e+04   1.146682e+03   0.000000e+00     10s
    2935    2.0067000e+04   0.000000e+00   0.000000e+00     11s
    2935    2.0067000e+04   0.000000e+00   0.000000e+00     11s

Root relaxation: objective 2.006700e+04, 2935 iterations, 5.29 seconds (0.38 work units)

    Nodes    |    Current Node    |     Objective Bounds      |     Work
 Expl Unexpl |  Obj  Depth IntInf | Incumbent    BestBd   Gap | It/Node Time

     0     0 20067.0000    0  130          - 20067.0000      -     -   13s
     0     0 18605.0000    0   91          - 18605.0000      -     -   15s
     0     0 17964.0000    0   49          - 17964.0000      -     -   18s
     0     0 17964.0000    0   42          - 17964.0000      -     -   18s
     0     0 17964.0000    0   56          - 17964.0000      -     -   19s
     0     0 17964.0000    0   50          - 17964.0000      -     -   19s
     0     0 17964.0000    0   37          - 17964.0000      -     -   20s
     0     0 17964.0000    0   41          - 17964.0000      -     -   21s
     0     0 17964.0000    0   44          - 17964.0000      -     -   22s
     0     0 17964.0000    0   56          - 17964.0000      -     -   22s
     0     0 17964.0000    0   46          - 17964.0000      -     -   24s
     0     0 17964.0000    0   45          - 17964.0000      -     -   24s
     0     0 17964.0000    0   27          - 17964.0000      -     -   26s
     0     0 17964.0000    0   23          - 17964.0000      -     -   27s
     0     0 17964.0000    0   46          - 17964.0000      -     -   31s
     0     0 17964.0000    0   42          - 17964.0000      -     -   33s
     0     2 17964.0000    0   11          - 17964.0000      -     -   47s
    61    92 13781.0000    6   69          - 17964.0000      -   256   50s
   551   407 9499.00000   23   43          - 17964.0000      -   176   55s
  1158   671 17962.2948   12  106          - 17964.0000      -   163   60s
  2030   955 17962.2848   10   99          - 17964.0000      -   155   66s
  2521  1134 17904.2015   13   94          - 17964.0000      -   154   70s
  3399  1413 17809.0008   15  138          - 17964.0000      -   150   76s
  4003  1568 14969.7879   21   53          - 17964.0000      -   147   80s
  4870  1861 17963.3689   14   86          - 17964.0000      -   147   85s
  6030  2093 infeasible   24               - 17964.0000      -   143   90s
  7068  2242 16520.0000   20   42          - 17964.0000      -   139   96s
  7070  2243 17909.0000   10  174          - 17964.0000      -   139  114s
  7071  2244 17346.0000   26   79          - 17964.0000      -   139  123s
  7072  2245 13726.0000   17   57          - 17964.0000      -   139  125s
  7074  2246 14700.0000   19   54          - 17964.0000      -   139  130s
  7076  2247 16988.0000   12   59          - 17964.0000      -   139  135s
  7078  2249 17576.0000   13   58          - 17964.0000      -   139  141s
  7079  2249 17346.0000   13   57          - 17964.0000      -   139  146s
  7081  2251 14249.0000   30   34          - 17964.0000      -   139  152s
  7083  2252 16564.9219   13   25          - 17964.0000      -   139  158s
  7085  2253 16370.0000   15   23          - 17964.0000      -   139  163s
  7087  2255 16959.0000   15   46          - 17964.0000      -   139  170s
  7089  2256 17346.0000   14   92          - 17964.0000      -   139  179s
  7090  2257 17346.0000   15   46          - 17964.0000      -   139  210s
  7091  2257 17744.4402   12   46          - 17964.0000      -   139  228s
  7092  2261 17964.0000   16   47          - 17964.0000      -   4.3  235s
  7106  2282 17964.0000   19   54          - 17964.0000      -   4.6  242s
  7152  2321 17963.9899   21   98          - 17964.0000      -   6.7  246s
  7248  2367 17963.9130   23  107          - 17964.0000      -  10.4  252s
  7382  2385 infeasible   24               - 17964.0000      -  14.0  256s
  7534  2370 17628.8412   25  131          - 17964.0000      -  17.3  262s
  7596  2372 17631.0000   25   44          - 17964.0000      -  19.0  265s
  7865  2371 17497.3438   30   57          - 17964.0000      -  24.5  271s
  8007  2351 17013.0000   32   18          - 17964.0000      -  27.0  276s
  8174  2354 infeasible   35               - 17964.0000      -  29.9  280s
  8282  2337 16349.7707   33   70          - 17964.0000      -  31.6  289s
  8377  2334 infeasible   35               - 17964.0000      -  33.3  291s
  8610  2338 17568.2188   25  115          - 17964.0000      -  37.2  296s
  8884  2291 17964.0000   26   42          - 17964.0000      -  41.7  308s
  8989  2291 17453.0938   27   82          - 17964.0000      -  43.8  310s
  9260  2238 17964.0000   27   39          - 17964.0000      -  48.8  316s
  9564  2200 17964.0000   31   35          - 17964.0000      -  54.6  324s
  9713  2198 17964.0000   32   28          - 17964.0000      -  57.8  327s
 10013  2124 infeasible   33               - 17964.0000      -  62.9  331s
 10437  2023 13726.0000   35   30          - 17964.0000      -  68.8  336s
 10889  1908 infeasible   33               - 17962.7659      -  74.4  341s
 11132  1855 infeasible   33               - 17909.0000      -  77.7  348s
 11393  1786 17538.9274   40   74          - 17909.0000      -  79.8  350s
 12005  1691 16655.0000   29   31          - 17909.0000      -  84.9  355s
 12313  1587 infeasible   32               - 17909.0000      -  87.5  373s
 12471  1562 11696.5000   39   47          - 17909.0000      -  89.1  376s
 13278  1362 13916.0000   26   69          - 17868.2198      -  93.5  382s
 13979  1303 17630.7690   30   74          - 17868.2198      -  98.2  387s
 14426  1337 16545.0000   35   19          - 17631.0000      -   101  390s
 15342  1411 infeasible   38               - 17579.0516      -   105  397s
 15815  1467 13859.6289   33   77          - 17576.0000      -   107  401s
 16391  1450 infeasible   27               - 17568.7060      -   109  405s
 17545  1466 14710.0000   32   59          - 17495.9629      -   111  412s
 18109  1497 infeasible   35               - 17485.7734      -   113  416s
 18673  1479 13448.0000   38   48          - 17485.7734      -   114  421s
 19331  1498 13265.0000   41   66          - 17346.0000      -   116  426s
 20065  1463 17012.9434   34   53          - 17161.1856      -   117  441s
 20407  1439 16884.7632   28   67          - 17108.0000      -   118  446s
 21224  1351 13273.0000   34   52          - 17013.0000      -   119  452s
 21807  1286 infeasible   31               - 17011.3056      -   121  458s
 22602  1238 infeasible   42               - 16525.4551      -   122  465s
 23418  1219 infeasible   38               - 16403.5739      -   124  470s
 24331  1154 14249.0000   30   45          - 15673.4931      -   125  476s
 25031  1185 14194.0000   31   55          - 15208.0000      -   127  482s
 25870  1165 infeasible   33               - 14579.2986      -   129  489s
 26611  1181 infeasible   34               - 14249.0000      -   131  495s
 27286  1158 infeasible   31               - 14249.0000      -   133  504s
 28124  1107 13403.0361   32   46          - 14249.0000      -   135  513s
 29124   985 9584.00000   33   41          - 13861.0000      -   137  520s
 30242   972 9956.00000   32   47          - 13631.0000      -   138  551s
 30569   822 infeasible   36               - 13631.0000      -   138  561s
 31993   664 infeasible   34               - 13163.0000      -   139  571s
 33262   579 11826.0000   35   35          - 12940.0000      -   140  582s
 34668   374 infeasible   37               - 12294.0000      -   141  593s
 36019   151 infeasible   34               - 11826.0000      -   142  606s
 37175    19 9759.00000   34   59          - 11318.0000      -   143  615s

Cutting planes:
  Learned: 10
  Gomory: 9
  Lift-and-project: 2
  Cover: 263
  Implied bound: 11
  Projected implied bound: 7
  Clique: 2
  MIR: 91
  Mixing: 1
  StrongCG: 1
  Flow cover: 202
  GUB cover: 1
  Inf proof: 16
  Zero half: 23
  RLT: 47
  Relax-and-lift: 4
  BQP: 31

Explored 37784 nodes (6425784 simplex iterations) in 619.88 seconds (48.49 work units)
Thread count was 32 (of 128 available processors)

Solution count 0
No other solutions better than -1e+100

Model is infeasible
Best objective -, best bound -, gap -
TRYING 18 CLONES
Set parameter WLSAccessID
Set parameter WLSSecret
Set parameter LicenseID to value 2687964
Academic license 2687964 - for non-commercial use only - registered to sa___@iict.buet.ac.bd
Set parameter TimeLimit to value 86400
Gurobi Optimizer version 12.0.3 build v12.0.3rc0 (linux64 - "Rocky Linux 9.6 (Blue Onyx)")

CPU model: AMD EPYC 7702 64-Core Processor, instruction set [SSE2|AVX|AVX2]
Thread count: 128 physical cores, 128 logical processors, using up to 32 threads

Non-default parameters:
TimeLimit  86400

Academic license 2687964 - for non-commercial use only - registered to sa___@iict.buet.ac.bd
Optimize a model with 29397 rows, 2751 columns and 86607 nonzeros
Model fingerprint: 0x772c8bb6
Model has 152 quadratic constraints
Variable types: 1516 continuous, 1235 integer (1235 binary)
Coefficient statistics:
  Matrix range     [2e-01, 3e+05]
  QMatrix range    [1e+00, 1e+00]
  QLMatrix range   [2e+01, 2e+01]
  Objective range  [3e+02, 4e+03]
  Bounds range     [1e+00, 1e+00]
  RHS range        [1e+00, 4e+00]
  QRHS range       [2e+01, 2e+01]
Presolve removed 22205 rows and 1683 columns
Presolve time: 4.04s
Presolved: 7242 rows, 1093 columns, 22433 nonzeros
Variable types: 517 continuous, 576 integer (574 binary)

Root simplex log...

Iteration    Objective       Primal Inf.    Dual Inf.      Time
     911    2.0067000e+04   1.966290e+06   0.000000e+00      5s
    2171    2.0067000e+04   0.000000e+00   0.000000e+00      9s
    2171    2.0067000e+04   0.000000e+00   0.000000e+00      9s

Root relaxation: objective 2.006700e+04, 2171 iterations, 4.25 seconds (0.24 work units)
Total elapsed time = 10.24s (DegenMoves)

    Nodes    |    Current Node    |     Objective Bounds      |     Work
 Expl Unexpl |  Obj  Depth IntInf | Incumbent    BestBd   Gap | It/Node Time

     0     0 20067.0000    0  133          - 20067.0000      -     -   14s
     0     0 18605.0000    0   95          - 18605.0000      -     -   17s
     0     0 17964.0000    0   93          - 17964.0000      -     -   18s
     0     0 17964.0000    0   76          - 17964.0000      -     -   20s
     0     0 17964.0000    0   73          - 17964.0000      -     -   20s
     0     0 17964.0000    0   61          - 17964.0000      -     -   21s
     0     0 17964.0000    0   49          - 17964.0000      -     -   22s
     0     0 17964.0000    0   48          - 17964.0000      -     -   24s
     0     0 17964.0000    0   54          - 17964.0000      -     -   25s
     0     0 17964.0000    0   28          - 17964.0000      -     -   26s
     0     0 17964.0000    0   55          - 17964.0000      -     -   27s
     0     0 17964.0000    0   32          - 17964.0000      -     -   29s
     0     0 17964.0000    0   32          - 17964.0000      -     -   29s
     0     0 17964.0000    0   40          - 17964.0000      -     -   32s
     0     0 17964.0000    0   47          - 17964.0000      -     -   33s
     0     0 17964.0000    0   30          - 17964.0000      -     -   34s
     0     0 17964.0000    0   46          - 17964.0000      -     -   34s
     0     0 17964.0000    0   24          - 17964.0000      -     -   36s
     0     0 17964.0000    0   25          - 17964.0000      -     -   36s
     0     0 17964.0000    0   24          - 17964.0000      -     -   38s
     0     0 17964.0000    0   24          - 17964.0000      -     -   40s
     0     2 17964.0000    0   23          - 17964.0000      -     -   54s
     1     4 17964.0000    1   31          - 17964.0000      -   461   55s
   174   179 infeasible    7               - 17964.0000      -   231   60s
   759   457 17908.8969   13  104          - 17964.0000      -   161   65s
  1197   654 infeasible   15               - 17964.0000      -   157   71s
  1409   747 16988.0000   11   73          - 17964.0000      -   157   75s
  2040   991 16988.0000   16   69          - 17964.0000      -   145   81s
  2660  1136 17315.5000   23   34          - 17964.0000      -   140   86s
  3008  1257 17962.3056   16   79          - 17964.0000      -   138   90s
  4030  1569 13289.0000   22   72          - 17964.0000      -   131   96s
  5061  1846 17346.0000   14   43          - 17964.0000      -   126  102s
  5682  1994 17346.0000   13   46          - 17964.0000      -   124  105s
  6747  2168 17550.9407   18   79          - 17964.0000      -   119  111s
  7594  2302 14249.0000   23   30          - 17940.8700      -   115  116s
  8499  2399 17908.9811    8  180          - 17909.0000      -   113  132s
  8500  2400 16878.0000   19   27          - 17909.0000      -   113  138s
  8502  2401 17730.0000   13   59          - 17909.0000      -   113  142s
  8504  2403 17346.0000   20   62          - 17909.0000      -   113  146s
  8506  2404 16988.0000   15   22          - 17909.0000      -   113  150s
  8510  2407 17013.0000   30   38          - 17909.0000      -   113  155s
  8516  2411 11732.0000   20   55          - 17909.0000      -   113  162s
  8519  2413 16988.0000   23   37          - 17909.0000      -   113  176s
  8520  2413 16988.0000   11   37          - 17909.0000      -   113  187s
  8523  2420 17909.0000   17   32          - 17909.0000      -   2.9  190s
  8609  2502 17909.0000   22   36          - 17909.0000      -   4.9  195s
  8791  2532 17909.0000   24   32          - 17909.0000      -   8.4  200s
  9060  2509 17655.0000   27   75          - 17909.0000      -  12.8  205s
  9307  2496 infeasible   29               - 17909.0000      -  16.8  211s
  9519  2494 infeasible   31               - 17909.0000      -  20.2  219s
  9608  2488 12655.0000   32   53          - 17909.0000      -  21.4  220s
  9808  2443 11301.0000   33   27          - 17909.0000      -  24.2  225s
 10152  2409 13273.0000   37   47          - 17909.0000      -  29.6  230s
 10487  2360 17765.9465   25  101          - 17909.0000      -  34.8  236s
 10816  2275 17909.0000   28   95          - 17909.0000      -  38.3  241s
 11118  2209 17631.0000   32   34          - 17909.0000      -  41.8  245s
 11526  2143 17862.2000   33   79          - 17909.0000      -  45.1  253s
 11676  2091 17909.0000   36   42          - 17909.0000      -  46.4  255s
 12329  1951 17574.6289   25   70          - 17909.0000      -  51.6  262s
 12627  1844 infeasible   33               - 17909.0000      -  53.4  265s
 13192  1678 13726.0000   31   39          - 17909.0000      -  56.9  270s
 13871  1476 17631.0000   30   36          - 17881.2500      -  60.3  286s
 14567  1246 17615.7500   30   55          - 17631.0000      -  63.1  290s
 15390   985 infeasible   28               - 17631.0000      -  66.4  297s
 16125   884 infeasible   37               - 17496.0000      -  69.4  301s
 17072   805 infeasible   29               - 17343.6466      -  72.5  307s
 17578   781 infeasible   26               - 17338.8000      -  73.8  311s
 18713   805 13273.0000   29   42          - 16878.0000      -  76.8  318s
 19218   822 14249.0000   22   46          - 16476.8001      -  78.3  333s
 19439   870 14249.0000   25   37          - 16368.5430      -  79.0  336s
 20028   918 13781.0000   33   51          - 15431.5859      -  80.9  340s
 20800  1039 12472.0000   43   37          - 14249.0000      -  85.0  347s
 21283  1114 12100.3750   35   57          - 14249.0000      -  87.4  352s
 21778  1130 14248.7585   28  106          - 14249.0000      -  90.1  357s
 22175  1169 14249.0000   37   51          - 14249.0000      -  92.7  362s
 22645  1185 14249.0000   42   69          - 14249.0000      -  95.3  367s
 23167  1161 infeasible   44               - 14249.0000      -  98.1  370s
 24198  1270 13602.9046   31  125          - 14194.0000      -   102  380s
 24899  1250 12885.0000   32   31          - 14194.0000      -   104  388s
 25689  1316 13744.0000   29   57          - 14194.0000      -   106  394s
 26509  1317 11480.1016   33   54          - 14005.0000      -   108  400s
 27263  1391 5463.00000   30   30          - 13916.0000      -   110  406s
 28194  1476 13298.0000   35   51          - 13781.0000      -   111  412s
 29108  1542 13627.1875   35   53          - 13780.9747      -   112  422s
 29896  1624 13549.0000   30   32          - 13642.7715      -   114  431s
 31192  1577 12322.0000   35   39          - 13631.0000      -   115  440s
 32144  1618 13273.0000   37   55          - 13631.0000      -   117  447s
 33373  1595 infeasible   37               - 13448.0000      -   117  467s
 33649  1554 13268.2430   31   71          - 13443.4226      -   118  478s
 34841  1560 7828.00000   46   39          - 13273.0000      -   120  486s
 36189  1529 infeasible   33               - 13273.0000      -   121  496s
 37482  1470 infeasible   31               - 13218.0000      -   122  507s
 38734  1446 infeasible   36               - 12940.0000      -   124  517s
 40128  1326 9969.95999   27  103          - 12655.0000      -   125  529s
 41484  1152 11632.0000   29   25          - 12518.0000      -   126  540s
 43155   881 11431.9180   30   64          - 12294.0000      -   127  549s
 44667   771 9967.00000   41   45          - 11340.0549      -   128  560s
 46597   516 infeasible   29               - 9967.00000      -   128  573s
 48341   110 9171.00000   38   56          - 9627.03589      -   129  582s
 49951     0 infeasible   49               - 8528.00000      -   129  588s

Cutting planes:
  Learned: 9
  Gomory: 9
  Cover: 361
  Implied bound: 22
  Clique: 2
  MIR: 96
  StrongCG: 2
  Flow cover: 226
  GUB cover: 1
  Inf proof: 22
  Zero half: 28
  RLT: 64
  Relax-and-lift: 2
  BQP: 12

Explored 50337 nodes (7476914 simplex iterations) in 588.14 seconds (48.98 work units)
Thread count was 32 (of 128 available processors)

Solution count 0
No other solutions better than -1e+100

Model is infeasible
Best objective -, best bound -, gap -
TRYING 17 CLONES
Set parameter WLSAccessID
Set parameter WLSSecret
Set parameter LicenseID to value 2687964
Academic license 2687964 - for non-commercial use only - registered to sa___@iict.buet.ac.bd
Set parameter TimeLimit to value 86400
Gurobi Optimizer version 12.0.3 build v12.0.3rc0 (linux64 - "Rocky Linux 9.6 (Blue Onyx)")

CPU model: AMD EPYC 7702 64-Core Processor, instruction set [SSE2|AVX|AVX2]
Thread count: 128 physical cores, 128 logical processors, using up to 32 threads

Non-default parameters:
TimeLimit  86400

Academic license 2687964 - for non-commercial use only - registered to sa___@iict.buet.ac.bd
Optimize a model with 28123 rows, 2652 columns and 82822 nonzeros
Model fingerprint: 0xc5a31941
Model has 152 quadratic constraints
Variable types: 1436 continuous, 1216 integer (1216 binary)
Coefficient statistics:
  Matrix range     [2e-01, 3e+05]
  QMatrix range    [1e+00, 1e+00]
  QLMatrix range   [2e+01, 2e+01]
  Objective range  [3e+02, 4e+03]
  Bounds range     [1e+00, 1e+00]
  RHS range        [1e+00, 4e+00]
  QRHS range       [2e+01, 2e+01]
Presolve removed 21329 rows and 1629 columns
Presolve time: 2.76s
Presolved: 6842 rows, 1047 columns, 21178 nonzeros
Variable types: 487 continuous, 560 integer (558 binary)

Root simplex log...

Iteration    Objective       Primal Inf.    Dual Inf.      Time
    1809    2.0066999e+04   1.554812e+02   0.000000e+00      5s
    2375    2.0067000e+04   0.000000e+00   0.000000e+00      6s
    2375    2.0067000e+04   0.000000e+00   0.000000e+00      6s

Root relaxation: objective 2.006700e+04, 2375 iterations, 2.90 seconds (0.27 work units)
Total elapsed time = 11.79s (DegenMoves)

    Nodes    |    Current Node    |     Objective Bounds      |     Work
 Expl Unexpl |  Obj  Depth IntInf | Incumbent    BestBd   Gap | It/Node Time

     0     0 20067.0000    0  194          - 20067.0000      -     -   12s
     0     0 18605.0000    0  111          - 18605.0000      -     -   14s
     0     0 17964.0000    0   88          - 17964.0000      -     -   15s
     0     0 17964.0000    0   88          - 17964.0000      -     -   16s
     0     0 17964.0000    0   77          - 17964.0000      -     -   16s
     0     0 17964.0000    0   49          - 17964.0000      -     -   18s
     0     0 17964.0000    0   42          - 17964.0000      -     -   18s
     0     0 17964.0000    0   12          - 17964.0000      -     -   20s
     0     0 17964.0000    0   11          - 17964.0000      -     -   20s
     0     0 17964.0000    0   20          - 17964.0000      -     -   21s
     0     0 17964.0000    0   22          - 17964.0000      -     -   21s
     0     0 17964.0000    0   30          - 17964.0000      -     -   22s
     0     0 17964.0000    0   31          - 17964.0000      -     -   22s
     0     0 17964.0000    0   24          - 17964.0000      -     -   23s
     0     0 17964.0000    0   43          - 17964.0000      -     -   23s
     0     0 17964.0000    0   19          - 17964.0000      -     -   24s
     0     0 17964.0000    0   26          - 17964.0000      -     -   25s
     0     0 17964.0000    0   19          - 17964.0000      -     -   25s
     0     0 17964.0000    0   19          - 17964.0000      -     -   26s
     0     2 17964.0000    0   19          - 17964.0000      -     -   32s
    63    85 17485.7224    6  111          - 17964.0000      -   250   35s
   624   456 17963.9983   14   94          - 17964.0000      -   140   40s
  1266   707 17553.2034   20  140          - 17964.0000      -   128   45s
  2083  1054 infeasible   27               - 17964.0000      -   122   50s
  2855  1281 17963.5895   10   98          - 17964.0000      -   119   56s
  3307  1465 17876.9975   11   83          - 17964.0000      -   122   60s
  4030  1754 16988.0000   20   48          - 17964.0000      -   123   66s
  4869  2064 16655.0000   18   34          - 17964.0000      -   123   71s
  5636  2235 16401.7217   20   19          - 17964.0000      -   123   75s
  5638  2236 14755.5080   31  124          - 17964.0000      -   123   83s
  5639  2237 16655.0000   16   92          - 17964.0000      -   123   89s
  5640  2238 13631.0000   24   56          - 17964.0000      -   123   90s
  5641  2238 17909.0000   11   58          - 17964.0000      -   123   96s
  5643  2240 17909.0000   15   39          - 17964.0000      -   123  100s
  5647  2242 16009.0000   22   40          - 17964.0000      -   123  106s
  5650  2244 16738.0000   22   48          - 17964.0000      -   123  110s
  5652  2246 16984.5313   27   37          - 17964.0000      -   123  115s
  5655  2248 16370.0000   29   45          - 17964.0000      -   123  121s
  5658  2250 9967.00000   20   22          - 17964.0000      -   123  144s
  5659  2250 17346.0000   22   22          - 17964.0000      -   123  152s
  5666  2262 17964.0000   13   40          - 17964.0000      -   4.8  155s
  5746  2342 17963.9228   17   94          - 17964.0000      -   8.4  160s
  6011  2383 17963.2791   20   75          - 17964.0000      -  16.1  165s
  6296  2368 17917.1086   22   73          - 17964.0000      -  22.6  171s
  6498  2346 infeasible   23               - 17964.0000      -  27.1  175s
  6837  2334 17631.0000   30   29          - 17964.0000      -  33.8  183s
  6929  2329 17629.2971   31   78          - 17964.0000      -  35.7  185s
  7252  2276 infeasible   34               - 17964.0000      -  43.0  190s
  7588  2233 17963.4000   22   97          - 17964.0000      -  51.2  195s
  7851  2177 infeasible   23               - 17964.0000      -  55.8  202s
  8185  2110 infeasible   25               - 17964.0000      -  60.3  205s
  8601  2017 infeasible   20               - 17963.9279      -  64.3  214s
  8756  1972 infeasible   27               - 17963.9279      -  65.4  216s
  9251  1913 infeasible   26               - 17962.2499      -  69.4  220s
 10014  1758 13414.0000   24   46          - 17941.4435      -  75.6  226s
 10522  1638 17909.0000   27   17          - 17941.4435      -  79.5  231s
 11130  1475 infeasible   27               - 17909.0000      -  83.3  235s
 11772  1355 infeasible   33               - 17908.9667      -  87.2  240s
 12494  1247 infeasible   25               - 17654.4167      -  91.2  245s
 12893  1234 13780.9703   21   86          - 17654.4167      -  93.2  256s
 13510  1327 13765.3608   27   96          - 17631.0000      -  96.5  262s
 13910  1381 infeasible   27               - 17630.9459      -  98.6  265s
 14851  1449 infeasible   37               - 17630.7984      -   102  273s
 15327  1548 15152.4134   25   27          - 17576.0000      -   103  277s
 15888  1581 infeasible   25               - 17576.0000      -   105  282s
 16421  1600 infeasible   30               - 17576.0000      -   106  289s
 16846  1670 16370.0000   21   27          - 17576.0000      -   108  294s
 17491  1648 infeasible   27               - 17545.8674      -   109  297s
 18135  1665 10756.0000   30   33          - 17346.0000      -   110  318s
 18441  1678 17163.0000   24   15          - 17338.6535      -   110  323s
 19269  1695 13298.0000   28   31          - 17163.0000      -   111  327s
 20048  1743 16482.4167   26   42          - 17163.0000      -   112  331s
 20957  1667 infeasible   26               - 17163.0000      -   113  337s
 21800  1644 infeasible   27               - 16878.0000      -   113  341s
 22698  1491 16319.6988   26   74          - 16600.0000      -   113  345s
 23634  1449 infeasible   38               - 16233.0000      -   114  351s
 24655  1434 10648.0000   32   31          - 16172.0000      -   114  356s
 25529  1421 infeasible   28               - 15707.0000      -   115  361s
 26337  1445 13218.0000   26   38          - 15338.5260      -   116  366s
 27146  1415 infeasible   33               - 15208.0000      -   118  372s
 27785  1458 14194.0000   29   65          - 15207.2703      -   121  379s
 28460  1429 infeasible   30               - 14249.0000      -   123  388s
 29236  1439 12688.7950   28   70          - 14243.9091      -   125  396s
 30244  1475 13140.5930   35   67          - 14194.0000      -   127  404s
 31298  1413 13861.0000   31   51          - 13916.0000      -   128  415s
 32350  1437 infeasible   30               - 13861.0000      -   130  423s
 33568  1342 12884.0436   31   56          - 13861.0000      -   131  430s
 34790  1315 infeasible   42               - 13861.0000      -   133  439s
 36205  1312 12830.0000   37   23          - 13447.9849      -   134  467s
 36660  1164 13393.0000   32   29          - 13447.9849      -   134  478s
 38235   971 12547.3930   23   66          - 13393.0000      -   136  491s
 40040   691 infeasible   41               - 12517.9974      -   137  505s
 41885   271 infeasible   36               - 12294.0000      -   138  519s
 43439   271 10205.0000   37   33          - 11961.0000      -   138  520s
 43607     0 10423.0000   27   39          - 11961.0000      -   138  527s

Cutting planes:
  Learned: 2
  Gomory: 6
  Cover: 316
  Implied bound: 18
  Projected implied bound: 3
  Clique: 1
  MIR: 76
  Flow cover: 201
  GUB cover: 1
  Inf proof: 9
  Zero half: 19
  RLT: 74
  Relax-and-lift: 12
  BQP: 2

Explored 44553 nodes (6874006 simplex iterations) in 527.41 seconds (45.21 work units)
Thread count was 32 (of 128 available processors)

Solution count 0
No other solutions better than -1e+100

Model is infeasible
Best objective -, best bound -, gap -
TRYING 16 CLONES
Set parameter WLSAccessID
Set parameter WLSSecret
Set parameter LicenseID to value 2687964
Academic license 2687964 - for non-commercial use only - registered to sa___@iict.buet.ac.bd
Set parameter TimeLimit to value 86400
Gurobi Optimizer version 12.0.3 build v12.0.3rc0 (linux64 - "Rocky Linux 9.6 (Blue Onyx)")

CPU model: AMD EPYC 7702 64-Core Processor, instruction set [SSE2|AVX|AVX2]
Thread count: 128 physical cores, 128 logical processors, using up to 32 threads

Non-default parameters:
TimeLimit  86400

Academic license 2687964 - for non-commercial use only - registered to sa___@iict.buet.ac.bd
Optimize a model with 26849 rows, 2553 columns and 79037 nonzeros
Model fingerprint: 0xe9ca4532
Model has 152 quadratic constraints
Variable types: 1356 continuous, 1197 integer (1197 binary)
Coefficient statistics:
  Matrix range     [2e-01, 3e+05]
  QMatrix range    [1e+00, 1e+00]
  QLMatrix range   [2e+01, 2e+01]
  Objective range  [3e+02, 4e+03]
  Bounds range     [1e+00, 1e+00]
  RHS range        [1e+00, 4e+00]
  QRHS range       [2e+01, 2e+01]
Presolve removed 20425 rows and 1571 columns
Presolve time: 4.98s
Presolved: 6478 rows, 1009 columns, 20013 nonzeros
Variable types: 457 continuous, 552 integer (550 binary)

Root simplex log...

Iteration    Objective       Primal Inf.    Dual Inf.      Time
       0    2.1997000e+04   2.297148e+02   0.000000e+00      5s
    1515    2.0067000e+04   0.000000e+00   0.000000e+00      6s
    1515    2.0067000e+04   0.000000e+00   0.000000e+00      6s

Root relaxation: objective 2.006700e+04, 1515 iterations, 1.16 seconds (0.11 work units)

    Nodes    |    Current Node    |     Objective Bounds      |     Work
 Expl Unexpl |  Obj  Depth IntInf | Incumbent    BestBd   Gap | It/Node Time

     0     0 20067.0000    0   98          - 20067.0000      -     -    9s
     0     0 18605.0000    0   74          - 18605.0000      -     -   11s
     0     0 17964.0000    0   74          - 17964.0000      -     -   11s
     0     0 17964.0000    0   53          - 17964.0000      -     -   13s
     0     0 17964.0000    0   54          - 17964.0000      -     -   13s
     0     0 17964.0000    0   57          - 17964.0000      -     -   14s
     0     0 17964.0000    0   55          - 17964.0000      -     -   14s
     0     0 17964.0000    0   45          - 17964.0000      -     -   16s
     0     0 17964.0000    0   39          - 17964.0000      -     -   16s
     0     0 17964.0000    0   37          - 17964.0000      -     -   17s
     0     0 17964.0000    0   33          - 17964.0000      -     -   17s
     0     0 17964.0000    0   10          - 17964.0000      -     -   19s
     0     0 17964.0000    0   19          - 17964.0000      -     -   19s
     0     0 17964.0000    0   29          - 17964.0000      -     -   20s
     0     0 17964.0000    0   26          - 17964.0000      -     -   20s
     0     0 17964.0000    0   27          - 17964.0000      -     -   21s
     0     0 17964.0000    0   26          - 17964.0000      -     -   21s
     0     0 17964.0000    0   10          - 17964.0000      -     -   22s
     0     0 17964.0000    0   10          - 17964.0000      -     -   23s
     0     2 17964.0000    0   10          - 17964.0000      -     -   31s
   161   179 13771.9260    8  138          - 17964.0000      -   160   35s
   514   354 13765.3906   13   61          - 17964.0000      -   131   40s
  1355   723 17496.0000   12   33          - 17964.0000      -   107   45s
  2554  1236 infeasible   19               - 17964.0000      -   101   50s
  4229  1697 16983.8032   14   61          - 17964.0000      -  92.9   55s
  5537  2015 infeasible   34               - 17964.0000      -  89.3   60s
  6821  2276 13631.0000   21  122          - 17909.0000      -  86.9   75s
  6822  2277 13687.0000   19   29          - 17909.0000      -  86.9   80s
  6827  2280 17345.8868   22   26          - 17909.0000      -  86.8   85s
  6830  2282 17346.0000   26    3          - 17909.0000      -  86.8   90s
  6838  2288 16852.0000   15   24          - 17909.0000      -  86.7   96s
  6841  2290 17901.5833   10   19          - 17909.0000      -  86.6  109s
  6842  2290 17184.0000   13   19          - 17909.0000      -  86.6  116s
  6905  2354 17909.0000   18   80          - 17909.0000      -   3.9  120s
  7199  2417 infeasible   25               - 17909.0000      -  11.0  125s
  7616  2406 infeasible   26               - 17909.0000      -  19.1  130s
  7912  2334 16568.2188   24   61          - 17909.0000      -  25.5  135s
  8309  2288 17496.0000   28   30          - 17909.0000      -  32.8  141s
  8762  2241 17907.4444   25  107          - 17909.0000      -  38.8  145s
  9087  2141 17495.9966   30   56          - 17909.0000      -  41.9  150s
 10113  1872 infeasible   32               - 17909.0000      -  50.9  155s
 10765  1717 infeasible   28               - 17909.0000      -  57.1  161s
 11448  1485 infeasible   33               - 17908.9434      -  62.3  166s
 12251  1337 infeasible   47               - 17727.9116      -  67.5  172s
 12938  1179 16796.0000   33   11          - 17651.9997      -  70.8  175s
 14189   947 16851.9801   27   42          - 17630.1081      -  75.4  181s
 15041   956 infeasible   32               - 17613.7498      -  78.7  190s
 15745   899 14876.5000   34   73          - 17574.6289      -  81.3  195s
 17344   858 infeasible   33               - 17346.0000      -  85.2  202s
 17926   846 infeasible   36               - 17346.0000      -  86.4  205s
 19204   756 infeasible   33               - 17326.8438      -  88.9  211s
 20138   839 infeasible   33               - 16918.1563      -  92.2  216s
 20712   834 infeasible   35               - 16918.1563      -  93.9  227s
 21478   990 infeasible   37               - 14249.0000      -  96.4  233s
 22081  1043 9521.00000   32   28          - 14249.0000      -  98.5  238s
 22648  1053 14075.2500   38   39          - 14249.0000      -   101  242s
 23073  1106 14194.0000   33   50          - 14249.0000      -   103  246s
 23693  1120 13767.1667   34   94          - 14249.0000      -   105  251s
 24336  1146 infeasible   29               - 14194.0000      -   107  260s
 25110  1185 12294.0000   35   28          - 14194.0000      -   109  265s
 26726  1291 13781.0000   25   28          - 14193.8752      -   113  275s
 27458  1319 infeasible   34               - 13944.8286      -   114  281s
 28587  1251 infeasible   35               - 13781.0000      -   115  286s
 29587  1195 7216.00000   41   33          - 13448.0000      -   116  291s
 30798  1046 infeasible   33               - 13298.0000      -   117  299s
 32096   929 infeasible   37               - 13218.0000      -   118  305s
 33541   722 11943.9621   35   48          - 12851.0000      -   118  311s
 34966   577 8012.00000   40   23          - 12518.0000      -   119  316s
 36258   312 11807.8223   34   55          - 11808.0213      -   120  322s
 37745   112 infeasible   49               - 11493.0000      -   121  328s
 38775     0 infeasible   37               - 9542.00000      -   121  331s

Cutting planes:
  Learned: 7
  Gomory: 12
  Lift-and-project: 1
  Cover: 270
  Implied bound: 17
  MIR: 71
  Mixing: 3
  Flow cover: 152
  Inf proof: 2
  Zero half: 20
  RLT: 54
  Relax-and-lift: 5
  BQP: 9

Explored 39099 nodes (5340886 simplex iterations) in 331.16 seconds (31.17 work units)
Thread count was 32 (of 128 available processors)

Solution count 0
No other solutions better than -1e+100

Model is infeasible
Best objective -, best bound -, gap -
TRYING 15 CLONES
Set parameter WLSAccessID
Set parameter WLSSecret
Set parameter LicenseID to value 2687964
Academic license 2687964 - for non-commercial use only - registered to sa___@iict.buet.ac.bd
Set parameter TimeLimit to value 86400
Gurobi Optimizer version 12.0.3 build v12.0.3rc0 (linux64 - "Rocky Linux 9.6 (Blue Onyx)")

CPU model: AMD EPYC 7702 64-Core Processor, instruction set [SSE2|AVX|AVX2]
Thread count: 128 physical cores, 128 logical processors, using up to 32 threads

Non-default parameters:
TimeLimit  86400

Academic license 2687964 - for non-commercial use only - registered to sa___@iict.buet.ac.bd
Optimize a model with 25575 rows, 2454 columns and 75252 nonzeros
Model fingerprint: 0xb6e6ca43
Model has 152 quadratic constraints
Variable types: 1276 continuous, 1178 integer (1178 binary)
Coefficient statistics:
  Matrix range     [2e-01, 3e+05]
  QMatrix range    [1e+00, 1e+00]
  QLMatrix range   [2e+01, 2e+01]
  Objective range  [3e+02, 4e+03]
  Bounds range     [1e+00, 1e+00]
  RHS range        [1e+00, 4e+00]
  QRHS range       [2e+01, 2e+01]
Presolve removed 19569 rows and 1517 columns
Presolve time: 2.10s
Presolved: 6058 rows, 963 columns, 18708 nonzeros
Variable types: 427 continuous, 536 integer (534 binary)

Root relaxation: objective 2.006700e+04, 2362 iterations, 2.17 seconds (0.23 work units)
Total elapsed time = 5.26s (DegenMoves)

    Nodes    |    Current Node    |     Objective Bounds      |     Work
 Expl Unexpl |  Obj  Depth IntInf | Incumbent    BestBd   Gap | It/Node Time

     0     0 20067.0000    0  132          - 20067.0000      -     -    6s
     0     0 18605.0000    0  122          - 18605.0000      -     -   10s
     0     0 17964.0000    0   89          - 17964.0000      -     -   11s
     0     0 17964.0000    0   53          - 17964.0000      -     -   12s
     0     0 17964.0000    0   51          - 17964.0000      -     -   13s
     0     0 17964.0000    0   59          - 17964.0000      -     -   14s
     0     0 17964.0000    0   52          - 17964.0000      -     -   14s
     0     0 17964.0000    0   26          - 17964.0000      -     -   15s
     0     0 17964.0000    0   24          - 17964.0000      -     -   15s
     0     0 17964.0000    0   16          - 17964.0000      -     -   16s
     0     0 17964.0000    0   14          - 17964.0000      -     -   16s
     0     0 17964.0000    0   26          - 17964.0000      -     -   18s
     0     0 17964.0000    0   23          - 17964.0000      -     -   18s
     0     0 17964.0000    0   22          - 17964.0000      -     -   20s
     0     0 17964.0000    0   15          - 17964.0000      -     -   20s
     0     0 17964.0000    0    2          - 17964.0000      -     -   21s
     0     0 17964.0000    0   14          - 17964.0000      -     -   22s
     0     0 17964.0000    0   12          - 17964.0000      -     -   22s
     0     0 17964.0000    0   12          - 17964.0000      -     -   23s
     0     2 17964.0000    0   12          - 17964.0000      -     -   32s
   217   252 13781.0000    8   52          - 17964.0000      -   167   35s
   887   515 17964.0000    8   33          - 17964.0000      -   127   41s
  1212   621 17964.0000   11   33          - 17964.0000      -   135   45s
  1786   810 16008.9633   17  104          - 17964.0000      -   135   50s
